business_id,city,state,latitude,longitude,categories,checkin_count
vi5CbxgB_ondX_OmRVoM7Q,Nashville,TN,36.0824531,-86.7584772,"Hot Dogs, Burgers, Restaurants, Chicken Wings",8
HNzaClFrbRsA81y8Z3PfBw,Nashville,TN,36.1674543,-86.8188985,"Nail Technicians, Beauty & Spas, Nail Salons",0
Mud5k_Un5mkQgOPU55UGwQ,Nashville,TN,36.1273830905,-86.7127778165,"Bakeries, Desserts, Food",19
D7wErz8K0Hi64RVrZIS61w,Nashville,TN,36.0134129,-86.7042767,"Active Life, Amateur Sports Teams, Fitness & Instruction, Martial Arts",213
I1Qbx7TzdT0pduEtUA8wiQ,Nashville,TN,36.266352,-86.756741,"Restaurants, American (New)",22
m7-OF4M95sUbR_y5qSQ1kQ,Nashville,TN,36.1232644,-86.7897422,"Fashion, Shopping, Accessories, Shoe Stores, Women's Clothing",186
_CEcUVPVpFecHmZkRg9wpA,Nashville,TN,36.1901271869,-86.6837985075,"Active Life, Golf",15
9WjiuPSGe7LoDNnINRvk-g,Nashville,TN,36.1303213,-86.8559662,"Mexican, Restaurants",27
o0XILIZR6cdoBjJALeOJaA,Nashville,TN,36.043517,-86.960752,"American (New), Dinner Theater, Performing Arts, Restaurants, Arts & Entertainment, Cinema",34
Dy0tKkfoTVdFHblrvUob6g,Nashville,TN,36.1092594,-86.8148556,"Massage Therapy, Tui Na, Beauty & Spas, Massage, Health & Medical, Reflexology, Traditional Chinese Medicine",22
miCyYODskIygMgBQiRXOww,Nashville,TN,36.1439731,-86.8415161,"Beauty & Spas, Hair Salons, Barbers",257
Fc9miCvZiGRtOeXOkNv9UA,Nashville,TN,36.1410347,-86.8410954,"Recreation Centers, Active Life, Local Flavor",70
swmPCRi7bOu6ATAThAXYGw,Nashville,TN,36.1084025,-86.7464304,"Tree Services, Landscaping, Home Services",0
PA6yX2D4ZyqQCE4Xa6I_fg,Nashville,TN,36.109744,-86.7263762,"Restaurants, Mexican",13
mQ4Gba-tdIuq5yl2mNf-pw,Nashville,TN,36.04277,-86.713735,"Tires, Automotive, Auto Repair, Oil Change Stations, Transmission Repair",12
n4POU-0-b4kGyhJPwR89Fw,Nashville,TN,36.11381,-86.7665204,"Soul Food, American (Traditional), Restaurants, Southern",170
S3Wh6UCdFvN08s8JpKI7oQ,Nashville,TN,36.163098,-86.7792975,"Food, Grocery",120
OdSpgFExUDYaRpBdHaxmxw,Nashville,TN,36.1036135,-86.8162678,"Home Decor, Furniture Stores, Home & Garden, Shopping",2
KbPKWZ6VBmaI0tsyQvQ0hQ,Nashville,TN,36.204529,-86.778275,"Hotels, Hotels & Travel, Event Planning & Services",7
yfHAOJMyxx9e7Xx4SziIag,Nashville,TN,36.1326933,-86.7774975,"Bed & Breakfast, Event Planning & Services, Venues & Event Spaces, Hotels, Hotels & Travel, Wedding Chapels",7
pSuLQ7Tt20_Nz4hu_iT0CA,Nashville,TN,36.15291,-86.7947868,"Automotive, Car Wash",8
rMDTNc3huxGRGYqdNgD9ew,Nashville,TN,36.1515375,-86.7953035,"Home Services, Real Estate, Apartments",1
2LXZpOpL_rB80X5nTY7R7Q,Nashville,TN,36.1012527,-86.7400368,"Sports Bars, Bars, Nightlife, Dive Bars",3
CjR1XUNBmyi9JXxDQ8VdsA,Nashville,TN,36.081346,-86.726692,"Food, Mobile Phones, Fashion, Shopping, Department Stores, Grocery",207
NQLi6ELZ3bFwzyUiVs8pQA,Nashville,TN,36.125974,-86.845748,"Oil Change Stations, Automotive",43
UxLkYuEVdlMYwIw6ioZesQ,Nashville,TN,36.151017,-86.804933,"Restaurants, American (New)",0
e0kTrMIXTAmmvsmoli45hw,Nashville,TN,36.1566085,-86.778491,"Music Venues, Tours, Hotels & Travel, Arts & Entertainment, Bus Tours, Nightlife",2
lI072WLVzEXV8Bh1rwmlhw,Nashville,TN,36.1626887,-86.7786332,"Local Services, Food, Coffee & Tea, Community Service/Non-Profit",151
9WkBLlgBMPPS5es6hcQsEw,Nashville,TN,36.06,-86.67,"Restaurants, Caterers, Colombian, Event Planning & Services, Food Trucks, Empanadas, Food, Latin American",3
DuB7JAFDaR6RUJRLU1Avbw,Nashville,TN,36.1472009,-86.798874,"Restaurants, Fast Food, Mexican",415
BNMnyrNZNQNxQ7Qz1Jos7w,Nashville,TN,36.1696538,-86.6816933,"Pizza, Restaurants, Beer Bar, Food, Nightlife, Bars, Brewpubs, Breweries, Pubs",78
uYR2miLnOe8zDHzX8gpM5w,Nashville,TN,36.1566798,-86.8649891137,"Local Services, Self Storage",0
zFO0K_8NhCS05epO_0PvEw,Nashville,TN,36.076536,-86.920248,"Tobacco Shops, Vape Shops, Shopping",3
M-Cwi45ZHQvxu4jpFB66ww,Nashville,TN,36.1473082,-86.8081948,"Health Markets, Weight Loss Centers, Specialty Food, Food, Health & Medical, Juice Bars & Smoothies",184
a-gkPi0KFpRNGiJfJ8ARAg,Nashville,TN,36.1513311,-86.851306,"Breakfast & Brunch, American (New), Venues & Event Spaces, Event Planning & Services, Bars, Cocktail Bars, Nightlife, Restaurants, French",87
NgCRvX9F-y9VNJozOi9EHA,Nashville,TN,36.1892712,-86.7459427,"Sandwiches, Salad, Mediterranean, Restaurants",17
PAKZ3CLhtKQj8I8NvdfTtw,Nashville,TN,36.1519916326,-86.7846474219,"Vegan, Burgers, Caribbean, American (New), Latin American, French, Restaurants, Tapas/Small Plates, Gluten-Free, Vegetarian, Seafood",145
n6CUcxHpLCyWYvpFAGscpg,Nashville,TN,36.0941322,-86.6990232,"Home Cleaning, Carpet Cleaning, Air Duct Cleaning, Grout Services, Home Services, Local Services, Damage Restoration, Masonry/Concrete",0
MgNKNDW9Qccx2NYza8shww,Nashville,TN,36.1034189,-86.8153263,"Fitness & Instruction, Active Life, Brazilian Jiu-jitsu, Martial Arts",13
TCVi-zTrs6TXdQKtgm_J6Q,Nashville,TN,36.082449,-86.7584696,"Auto Repair, Automotive, Gas Stations",17
DhDVLG-UWd3ZVtAqSKlRcA,Nashville,TN,36.1389153,-86.8009504,"Convenience Stores, Gas Stations, Automotive, Food",39
itUfUv8PM1fVPXxFXPnAXw,Nashville,TN,36.0787669,-86.6414944,"Waxing, Beauty & Spas, Hair Removal",2
GTlGJH0lceTK0ICS5SLTlg,Nashville,TN,36.1749414,-86.7883292,"Burgers, Sandwiches, American (Traditional), Salad, Bars, Pizza, Nightlife, Restaurants",32
lekpmrVopRSaId-ZxrNVHQ,Nashville,TN,36.1973758,-86.741549,"Fast Food, Restaurants, Burgers",160
EIeDtIG5WoD9Fv2ppF3Y-A,Nashville,TN,36.105208,-86.817418,"Mediterranean, Greek, Restaurants",167
OGtK8D9vn_Dvcp1GJqJ3jg,Nashville,TN,36.202465,-86.777158,"Tex-Mex, Mexican, Tacos, Breakfast & Brunch, Restaurants, Fast Food",16
cquDeQN7gzg72tcI4hi9Rg,Nashville,TN,36.154234,-86.7731367,"Cafes, Event Planning & Services, Restaurants, Caterers, Coffee & Tea, Food",2
y1U5yM8Y4epv8m6qRAqq1w,Nashville,TN,36.112359,-86.7571059,"Car Dealers, Body Shops, Automotive, Auto Repair",35
Pd6oqJ_YVWnrCIF46dDzyg,Nashville,TN,36.1460552,-86.7795361,"Hair Removal, Makeup Artists, Beauty & Spas, Hair Salons",138
YeyDlIbOSI9OtXtRyNCobw,Nashville,TN,36.1167662,-86.7982138,"Performing Arts, Musical Instruments & Teachers, Shopping, Arts & Entertainment, Art Schools, Specialty Schools, Education",0
7-8FfqERmzMpbzU_zuMswQ,Nashville,TN,36.114521,-86.752399,"Pet Stores, Pets",126
KbZIVavCEStT_Unw3-ZBag,Nashville,TN,36.1696355063,-86.6832650232,"Diagnostic Services, Urgent Care, Health & Medical, Doctors",7
UkngeEjqXvMazUWad20l7Q,Nashville,TN,36.151017,-86.804933,"Hair Salons, Day Spas, Beauty & Spas, Shopping, Cosmetics & Beauty Supply",47
nSGdCxRgAymQs06mY0wSlw,Nashville,TN,36.1046641,-86.8196172,"Event Planning & Services, Caterers, Restaurants, Local Flavor, Southern, American (Traditional), Breakfast & Brunch",8
Mdj5GGI5Zu1ETkNFnojDZQ,Nashville,TN,36.158454,-86.8189748,"Restaurants, Chinese",27
8_fv7iqPtrCLX_l5lguDGw,Nashville,TN,36.132569,-86.8319959,"Synagogues, Religious Organizations",80
6fjHfzOQyhE4Cv8sJ_nzEA,Nashville,TN,36.1491442,-86.8642555,"Pet Groomers, Pets, Pet Services, Pet Boarding, Pet Sitting",0
LhfuO1SsfwqkqxnM4pM6jQ,Nashville,TN,36.0994869,-86.8213632,"Digitizing Services, Local Services, Photography Stores & Services, Shopping, Video/Film Production, Professional Services, Recording & Rehearsal Studios",1
3Cz4gsS8AT2a14jsMfqn4g,Nashville,TN,36.1195024,-86.6741078,"Car Rental, Hotels & Travel",50
Ol__WnjGjMr9aMlVePqUBg,Nashville,TN,36.0694809918,-86.6817099,"Check Cashing/Pay-day Loans, Financial Services, Title Loans, Installment Loans",1
p08guKw-66hwQTiskaAYiA,Nashville,TN,36.1739359,-86.750126,"Ice Cream & Frozen Yogurt, Food, Waffles, Restaurants",1
pHlHvNNH0OR6eHqdlQ8fhg,Nashville,TN,36.1050779953,-86.7958268737,"Gold Buyers, Shopping, Watch Repair, Jewelry, Local Services, Jewelry Repair, Watches",26
kIEPaEAFR0QoFDqsE0elkQ,Nashville,TN,36.2030359,-86.7389677,"Local Flavor, Restaurants, American (New), Nightlife, Bars",432
h6e-09OGlR0HKe2ChBO24g,Nashville,TN,36.107504,-86.814796,"Beauty & Spas, Nail Salons, Day Spas",30
kjjF25K1L1JbFwhZ4cbV9Q,Nashville,TN,36.1523805,-86.7893889,"Breweries, Brewpubs, Beer Tours, Tours, Transportation, Hotels & Travel, Distilleries, Wine Tours, Art Tours, Food, Bus Tours, Train Stations",0
Wbx6NhPA9bMpB4KRrqaN0Q,Nashville,TN,36.130829,-86.773127,"Beauty & Spas, Hair Salons",0
9IC7SB4GLZi-oS-w85j5AA,Nashville,TN,36.2300372,-86.7610028,"Chinese, Restaurants",33
zpPeS4x_9EFBobT_OHipQQ,Nashville,TN,36.1874355,-86.7464107,"Coffee & Tea, Food, Donuts",33
UO_YE-8Yrj_iseCgG0hRcA,Nashville,TN,36.2010212445,-86.6915551379,"Beauty & Spas, Cosmetics & Beauty Supply, Shopping, Perfume",0
vMV2SaKYz1HrXPJe6u9Xbw,Nashville,TN,36.162849996,-86.7759456442,"Tattoo, Fashion, Women's Clothing, Shopping, Beauty & Spas, Clothing Rental, Men's Clothing",6
J2LDXe1AOxsIBIxUfQAGRg,Nashville,TN,36.1535933462,-86.7508497,"Car Rental, Hotels & Travel",1
Go3GtC1yLModu489NPtfMw,Nashville,TN,36.126616,-86.7895002,"American (New), Restaurants, Tapas Bars",0
Z1YH3dvDwdM6_isWY4jtrQ,Nashville,TN,36.183998,-86.749696,"French, Spanish, Portuguese, Restaurants, Pop-Up Restaurants",58
9B-CyenTV-_X-Kv4xAH-tg,Nashville,TN,36.1356945,-86.6361325,"Automotive, Car Wash, Auto Detailing",51
6oWaOMzGPCe5fjZvINe6YQ,Nashville,TN,36.1294045,-86.8519526,"Sushi Bars, Restaurants, Japanese",620
aSUqH8LarnObj-16E8YMvg,Nashville,TN,36.177009,-86.7491019,"Event Planning & Services, Florists, Shopping, Wedding Planning, Flowers & Gifts",3
YVvEkZlUs9DeVWYZlS485Q,Nashville,TN,36.1550231,-86.7735969,"Estate Planning Law, Personal Injury Law, General Litigation, Professional Services, Employment Law, Lawyers",2
Z5qMfJcpNy-h9AMdP4qiKg,Nashville,TN,36.1696045,-86.6730893,"Public Services & Government, Libraries",26
nKJ6RnjIVfWrXO2DUrBgCw,Nashville,TN,36.0448979,-86.9538259,"Restaurants, Mexican",184
U3J_imHxyCx3hTLZprLPkA,Nashville,TN,36.210158,-86.732448,"Food, Grocery, Shopping, Photography Stores & Services",6
2HsnioWszOnG0XPIDhrilw,Nashville,TN,36.1432236569,-86.792703312,"Coffee Roasteries, Food, Coffee & Tea",27
95QB81YMzk8Lg5CwRHkmKg,Nashville,TN,36.1510847,-86.7940006,"Hair Salons, Beauty & Spas",27
efYk_lMnXplDILUKRaKbRw,Nashville,TN,36.0252525,-86.5871608,"Restaurants, Burgers, Fast Food",9
6RxJLsIoRSkUfvOxYP0sKQ,Nashville,TN,36.1530043,-86.8433279,"Taiwanese, Chinese, Restaurants",6
NNlLNd5I-3r4tfVKTP7UdQ,Nashville,TN,36.1548886,-86.7754139,"Real Estate, Apartments, Home Services",80
KbhKbjG7fVM2vTtO3qbe0w,Nashville,TN,36.1517816,-86.833844,"Indian, Restaurants, Gluten-Free, Vegan",189
Ie9g4uQ4hWAclxiegzlwaQ,Nashville,TN,36.1106228384,-86.7503067782,"Fireplace Services, Local Services, Grilling Equipment, Home Services, Home Decor, Appliances, Shopping, Home & Garden, Grill Services",9
Px6QPLnB7YM6nCCD0hrbsw,Nashville,TN,36.1795577239,-86.8115216216,"Car Window Tinting, Auto Glass Services, Auto Detailing, Car Wash, Automotive",0
Ueq5srlADo8pef4UcuqQTg,Nashville,TN,36.1320692147,-86.6697907448,"Breakfast & Brunch, Delis, Restaurants, Sandwiches",278
vCvZGMA1pPojOt53tUoQdQ,Nashville,TN,36.1032226,-86.8175231,"Shopping, Men's Clothing, Fashion, Women's Clothing, Shoe Stores",19
6Ug6HqpGMGY_v-uH_6WffQ,Nashville,TN,36.121851,-86.764599,"Electronics, Car Stereo Installation, Auto Parts & Supplies, Automotive, Shopping",1
dLDR_YATjAEdMSkQ0p9Qcw,Nashville,TN,36.1494298,-86.7797345,"Real Estate, Apartments, Home Services",0
tmJ1i7MRNEM2ByuwBOFNOg,Nashville,TN,36.1543048,-86.7995536,"Fitness & Instruction, Weight Loss Centers, Active Life, Boxing, Gyms, Trainers, Health & Medical",31
84IHk4QP3jlGTzsEk4_1sg,Nashville,TN,36.150944,-86.6752433,"Event Planning & Services, Hotels & Travel, Hotels",6
oMzeQNKRbnXlEYhY0H8k8w,Nashville,TN,36.135493,-86.887403,"Active Life, Playgrounds, Parks",10
l3S_LsPam6ejdQo37V4kVg,Nashville,TN,36.1520500835,-86.849803456,"Local Flavor, Coffee & Tea, Breakfast & Brunch, Flowers & Gifts, Restaurants, Venues & Event Spaces, Event Planning & Services, Food, Tea Rooms, Cafes, Arts & Crafts, Shopping",248
jZ_tVIYc47iXuZe3AbsGjw,Nashville,TN,36.2075971,-86.736176,"Restaurants, Chicken Shop, Comfort Food, Chicken Wings",8
VajelFxYOViyVnvBg7BuuQ,Nashville,TN,36.1253472,-86.7465652,"Auto Repair, Automotive, Tires",2
B686baieu1DvmaDLFdQ6KQ,Nashville,TN,36.0775432,-86.7315785,"Landscaping, Home Services, Masonry/Concrete, Patio Coverings",0
qdNRNugi-XWYFJ4N3DnInw,Nashville,TN,36.174701,-86.757232,"Local Flavor, Shopping, Nightlife, American (New), Arts & Entertainment, Restaurants, Bars",492
2h10228FGBXalIvesfeNQA,Nashville,TN,36.1767557908,-86.7753467368,"Food, Food Trucks, Tacos, Restaurants, Mexican",9
URonYUUfesq0RCIPV5kcxg,Nashville,TN,36.1654445146,-86.7794849365,"Local Services, Appliances & Repair",0
-ZJjxOYTWYbxD3yaz1CvCQ,Nashville,TN,36.1959769715,-86.7765049974,"Seafood, Restaurants",8
FXLGqtiqrazEHIRx4u0Jvg,Nashville,TN,36.1401255,-86.7695695,"Formal Wear, Fashion, Bespoke Clothing, Men's Clothing, Accessories, Shopping",0
tLNCYd71UbUhU1ljpJ4Ivw,Nashville,TN,36.1724885,-86.7805961,"Contractors, Home Services, Chimney Sweeps",0
Gmj8oyfKmr0ezXaB2XVuOg,Nashville,TN,36.0934791,-86.653178,"Food Trucks, Food, Mexican, Restaurants",7
6Otux9Q5_ztLBKop0xkmyw,Nashville,TN,36.0932716,-86.6770673,"Trampoline Parks, Recreation Centers, Active Life, Party & Event Planning, Event Planning & Services",96
brhWYRpbl6rJ8grRkXJtRw,Nashville,TN,36.0422963,-86.9542947,"Gyms, Child Care & Day Care, Fitness & Instruction, Active Life, Local Services",335
_P3x2ebIGg4ySwsAagWadw,Nashville,TN,36.07932725,-86.9546055,"Carpeting, Home Services, Home & Garden, Shopping, Building Supplies, Flooring, Rugs, Kitchen & Bath",0
N537QV8Omyv0pxEPWZtamQ,Nashville,TN,36.1432521588,-86.8745828181,"Tobacco Shops, Hobby Shops, Vape Shops, Shopping, Nightlife, Hookah Bars, Bars, Head Shops",25
6Bx_L3apO3q3lT6s32wuxQ,Nashville,TN,36.2130528,-86.7265483,"Home Cleaning, Home Services",0
DGCgdit_IKu02arIk-IB8A,Nashville,TN,36.1278412203,-86.8427594,"Wedding Planning, Party & Event Planning, Event Planning & Services, Bridal, Shopping",2
R9N9CFR1kno2K_oZvyy8SA,Nashville,TN,36.0802326,-86.8320743,"Food Trucks, Food",0
LuHb5HCrsGKN5VvekMOmuQ,Nashville,TN,36.0890145,-86.6482185,"Chinese, Seafood, Restaurants, Soup",16
6d25hRt6Hz4SPc9Ih327gw,Nashville,TN,36.1262355724,-86.7891158421,"Italian, Pizza, Food, Nightlife, Bars, Restaurants",1151
VYlwU6ftaIF1WLTQcX-F3A,Nashville,TN,36.1724885,-86.7805961,"Restaurants, Food Trucks, Food, Southern, Barbeque",5
vWmh3kJuehx3tDp6rrtqgA,Nashville,TN,36.1739359,-86.750126,"Restaurants, Tacos, Mexican, Tex-Mex",252
yafQdtH4wvyyD7lqjbzMhg,Nashville,TN,36.1365399,-86.802705,"Italian, Restaurants",244
EwTORrrsFp2Gxb5TPZHVwQ,Nashville,TN,36.2107535,-86.7299216,"Home Services, Local Services, Air Duct Cleaning, Heating & Air Conditioning/HVAC",0
K12GaNcIak26Tvsg0G9dbQ,Nashville,TN,36.1572036,-86.7401671,"Auto Customization, Automotive, Shopping, Wheel & Rim Repair, Customized Merchandise, Tires",9
qpgkWql42qgW095udiCLYg,Nashville,TN,36.074814,-86.9215071,"Coffee & Tea, Fast Food, Restaurants, Food, Burgers",110
9_OamekMThfSP0KgK0dnlQ,Nashville,TN,36.1353835,-86.7657546,"Arts & Entertainment, Local Flavor, Festivals, Performing Arts, Cinema",28
Zrp4WcwBdPvsjdLtQ6_K4A,Nashville,TN,36.1113708,-86.7532371,"Furniture Stores, Shopping, Home & Garden",4
F1LIBf-ZaJ63Y-AuvALq0w,Nashville,TN,36.1430062,-86.7923326,"Shopping Centers, Shopping, Food",115
8OZ92T0_hzk_LeJlXQTY_Q,Nashville,TN,36.2223072,-86.694927,"Event Planning & Services, Hotels, Hotels & Travel",12
B69wDo0Px_Si1Sz06g6VKw,Nashville,TN,36.1011643,-86.8191512,"Massage Therapy, Massage, Health & Medical, Beauty & Spas",2
h_q2vmF6bLauPPtiVC37zA,Nashville,TN,36.153204,-86.8003917,"Automotive, Auto Repair",26
fBc5T97oE9Dd-DvG04FHKA,Nashville,TN,36.1517643104,-86.7802841578,"Tacos, Mexican, Restaurants",14
o37egH3jB6egfgCbHIdoCA,Nashville,TN,36.1641931208,-86.7794759975,"Restaurants, Sandwiches, Italian, Pizza, American (New)",64
PYSsPOcHprXNNVBVw5XQRA,Nashville,TN,36.2276172,-86.7591962,"Breakfast & Brunch, Southern, Restaurants, American (New)",230
z1hzYowJaslvguWSMvgHUw,Nashville,TN,36.0744093,-86.7241431,"Banks & Credit Unions, Mortgage Brokers, Real Estate, Financial Services, Home Services",6
14TQ3FXCv8af1mGnRYEEYg,Nashville,TN,36.180697177,-86.8019416848,"Shoe Stores, Women's Clothing, Fashion, Men's Clothing, Accessories, Shopping, Leather Goods, Jewelry",21
GdfqRMGQD6h25NIvQgyfog,Nashville,TN,36.175219,-86.791994,"Pet Services, Pet Adoption, Pet Groomers, Animal Shelters, Pets, Pet Stores",6
xvu0enRUvnfsG8MDZAnu2A,Nashville,TN,36.1666667,-86.7833333,"American (Traditional), Food, Food Trucks, Restaurants",5
OMKOqZUbxKWBNDCwmxBDjA,Nashville,TN,36.1037166,-86.8691378,"Fashion, Local Services, Bike Repair/Maintenance, Sporting Goods, Shopping, Bikes, Sports Wear",17
ZmuLQItWzeN53UR-y7TjOQ,Nashville,TN,36.1449595,-86.8740361,"Discount Store, Convenience Stores, Grocery, Food, Fruits & Veggies, Beer, Wine & Spirits, Specialty Food, Organic Stores, Meat Shops, Shopping",38
SWTbqXTFyRriALYqVq0KDA,Nashville,TN,36.1370319,-86.7996125,"Day Spas, Nail Salons, Beauty & Spas",46
DsXPssyurWz4s-wYKcCPPA,Nashville,TN,36.1760646,-86.7503783,"Sports Clubs, Active Life",36
Jnxn6VH6L0fwSZDuBTjpTA,Nashville,TN,36.1387997,-86.8016422,"Food, Fast Food, Sandwiches, Restaurants",5
nQfH7T3neXbTa6Xkz7IFoQ,Nashville,TN,36.157975,-86.7848552,"Cocktail Bars, Food, Beer, Wine & Spirits, Wine Bars, Bars, Restaurants, Nightlife, Tapas/Small Plates, American (New)",22
evfBbxpCX8Ho-Hr0_Y48Nw,Nashville,TN,36.145781,-86.766334,"Used, Vintage & Consignment, Shopping, Fashion",6
XF3FLglc3eHQcX7wWKLMwQ,Nashville,TN,36.1786152,-86.7883468,"Cosmetic Dentists, Health & Medical, General Dentistry, Pediatric Dentists, Dentists",2
Psynglln2Cg-30XhVP_28g,Nashville,TN,36.148231,-86.798874,"Nightlife, Irish Pub, Sports Bars, Arts & Entertainment, Restaurants, Bars, Music Venues",27
T2D1wJo4Uon8VSQSARM0KA,Nashville,TN,36.1410253,-86.6711817,"Appliances & Repair, Local Services",0
QInWaJU8kCM41qstAg5_9A,Nashville,TN,36.0395043,-86.7411856,"Beauty & Spas, Tanning, Nail Salons, Massage, Cocktail Bars, Skin Care, Day Spas, Spray Tanning, Bars, Nightlife, Waxing, Hair Removal",807
fQIBmWDqYJof7Nx-G1rFOw,Nashville,TN,36.0791,-86.953,"Pets, Pet Training, Pet Stores, Pet Groomers, Pet Services",39
M4y-L-hawzeALHwXWFPujg,Nashville,TN,36.1751226,-86.792325,"Food, Food Trucks",5
1CD5kbIX1NWt3_NgAoQpvg,Nashville,TN,36.0802326,-86.8320743,"Trainers, Life Coach, Fitness & Instruction, Professional Services, Active Life, Nutritionists, Health & Medical",0
HmAXslizh5u54imb4ENT8g,Nashville,TN,36.157670449,-86.7586080818,"Home Services, Countertop Installation",0
j5siJykDq7GWzgSdpOjhdw,Nashville,TN,36.1759076,-86.7856404,"American (Traditional), Nightlife, Food, Restaurants, Bars, Burgers, Beer, Wine & Spirits",662
g0-l6D6l8W3BPfX9juwEHg,Nashville,TN,36.044343,-86.71689,"Medical Centers, Urgent Care, Health & Medical",6
4Pr7vM3R2slU1Thb-z_7Gg,Nashville,TN,36.0802326,-86.8320743,"Event Planning & Services, Caterers, Food, Custom Cakes, Cupcakes, Patisserie/Cake Shop, Bakeries",0
37a3glELGWp8evf_DrNfbQ,Nashville,TN,36.1070859,-86.8175144,"Women's Clothing, Department Stores, Fashion, Men's Clothing, Children's Clothing, Shopping",111
m_t0u1Z9bPmKRdEVBa-MJQ,Nashville,TN,36.1289925469,-86.6703465946,"Ethnic Food, Specialty Food, Food, Sushi Bars, Restaurants, Imported Food, Japanese",134
LGY50abwQOxJPkq0NKe99g,Nashville,TN,36.1298258,-86.7781337,"Sandwiches, Coffee & Tea, Food, Restaurants, Bakeries",90
CfKU7wqDmAi2N48eCJhiVA,Nashville,TN,36.1414753,-86.8025445,"Food, Farmers Market",11
qK3TXFNTYPdvKgRP07UchQ,Nashville,TN,36.1269757,-86.788991,"Accessories, Women's Clothing, Men's Clothing, Fashion, Shopping",15
24eGG105XL98jPPKOgCRxg,Nashville,TN,36.1779745,-86.751071,"Bars, Nightlife, Restaurants, American (New), Sandwiches, Delis",141
NOg2FV3f-twr9TcKBqjSAA,Nashville,TN,36.1424308423,-86.8009713846,"Physical Therapy, Health & Medical",55
EgZH_qXEQH_WJyNFgRaWDw,Nashville,TN,36.126026,-86.845443,"Shopping, Accessories, Women's Clothing, Fashion",69
vhe1SzsLE2rG6a9_Of8OFw,Nashville,TN,36.2199531,-86.6970639,"Home Decor, Home & Garden, Furniture Stores, Antiques, Shopping",6
w9PtHabNSKd2z40rnVRyLw,Nashville,TN,36.0800339,-86.9491094,"Beauty & Spas, Nail Salons",4
KRBGbYMUjaFHKPVYrMDLJA,Nashville,TN,36.040923,-86.7122720466,"Automotive, Tires, Auto Parts & Supplies, Wheel & Rim Repair",96
JycfyMakty6nHVwy2wggIQ,Nashville,TN,36.1497825,-86.7751638,"Ethnic Food, Restaurants, Food, Specialty Food, Grocery",19
dECEn8-37NHSyZbq2a1nQw,Nashville,TN,36.142146,-86.765285,"Arts & Entertainment, Art Supplies, Art Galleries, Shopping, Arts & Crafts",15
b7ew-fokdK3WI3SUx-KWcA,Nashville,TN,36.1278152466,-86.8037490845,"Beauty & Spas, Hair Removal, Skin Care, Eyelash Service, Waxing",14
Vg0_7YIyaabkDHKoWV8V9g,Nashville,TN,36.1460208,-86.813372,"Cajun/Creole, German, Sandwiches, American (Traditional), Beer Gardens, Breakfast & Brunch, Restaurants, Nightlife, Bars, Soul Food",62
sKkIIJHAFev0a28vboj60g,Nashville,TN,36.176361,-86.7513014,"Breakfast & Brunch, Restaurants, Pizza, Sandwiches, American (New)",103
1eSTFasf2RdQ74lWZn_BXA,Nashville,TN,36.1069585,-86.7661546,"Appliances, Home & Garden, Hardware Stores, Shopping, Nurseries & Gardening",565
lP1_ZarqvfPlSZHi9mr1bQ,Nashville,TN,36.1565894,-86.7963082,"Movers, Home Automation, Building Supplies, Keys & Locksmiths, Home & Garden, Shopping, Home Services",11
8uT-4m03cax_njm-zO4Tiw,Nashville,TN,36.2075526,-86.7812027,"Event Planning & Services, Hotels & Travel, Hotels",20
pPMGTHQbqkfqZ3D_Ftpfyw,Nashville,TN,36.2026228,-86.62105,"Laundromat, Laundry Services, Local Services",4
JhcAR32Mck-dXTMsz1OSFQ,Nashville,TN,36.1461293,-86.812737,"Bars, Nightlife, Pubs, Restaurants, Sports Bars, American (Traditional)",402
ExpamjGjg3r6Cl6RhbT67Q,Nashville,TN,36.081552,-86.727607,"Ethnic Food, Specialty Food, Food, Grocery",108
26OvYsM0A_1odu5heY59Vg,Nashville,TN,36.1603347346,-86.6304878,"Home Services, Real Estate, Apartments",1
pt-iIf9j6ZfYiKHYpLMJsA,Nashville,TN,36.1637318,-86.7801247,"Automotive, Auto Parts & Supplies, Professional Services, Home Services, Security Systems",36
WsYf3_6_GaOX1K1CXtAKag,Nashville,TN,36.165988,-86.8556895,"Restaurants, Burgers",50
XXl-m2TRerJRM4-OIoeS4w,Nashville,TN,36.1262408,-86.8463124,"Massage, Beauty & Spas, Nail Salons",91
IJ_-9Dwd06VA36qwO2p8bQ,Nashville,TN,36.2048129,-86.7246064,"Pet Services, Pet Groomers, Pet Sitting, Pets",13
BrkiHfoxaDfOPZ3oBzimGQ,Nashville,TN,36.0474566,-86.7152087,"Beauty & Spas, Nail Salons",2
GejL24eDR2yFmVc9Ip4COg,Nashville,TN,36.0906985,-86.7022151,"Hotels, Hotels & Travel, Event Planning & Services",3
5EPgeoxoSLLZbOL8chDjLA,Nashville,TN,36.1274127,-86.7891683,"Restaurants, Barbeque",18
uzHR9nIc9Es2dLpKDPXRZA,Nashville,TN,36.137957,-86.8197607622,"Caterers, Restaurants, Pakistani, Vegetarian, Buffets, Indian, Event Planning & Services",622
pTrehryhEXnp9Bh7ytXNng,Nashville,TN,36.1627678,-86.7820438,"Active Life, Bike Rentals",3
n3797K0qWBaU1t2uCQFx3g,Nashville,TN,36.1692789,-86.777848,"Music Venues, Arts & Entertainment, Parks, Active Life, Nightlife",315
ZIJObaHCg6JzLpXCP5OY7Q,Nashville,TN,36.1832492,-86.732245,"Men's Hair Salons, Nail Salons, Skin Care, Blow Dry/Out Services, Beauty & Spas, Hair Salons, Eyebrow Services, Hair Stylists, Hair Extensions",10
3iSRhLUZfZSlLaQw-BzloQ,Nashville,TN,36.1561134,-86.7863273,"Sushi Bars, Nightlife, Asian Fusion, Bars, Restaurants, Lounges",1068
nbhwOoz7yefs96oMK_lXsQ,Nashville,TN,36.1573504947,-86.8013993737,"Financial Services, Banks & Credit Unions",8
CRe_j_zZ9XynzSc2Sc0ggA,Nashville,TN,36.1625970436,-86.7799117037,"Sports Bars, Nightlife, Burgers, Barbeque, Southern, Restaurants, Bars, American (New), American (Traditional)",96
ppmwNk6adNqHAWgVnKyZIg,Nashville,TN,36.1012344,-86.8193276,"Beauty & Spas, Nail Salons",39
6_4b2-5XdieRFJZ-SqF-Gg,Nashville,TN,36.094874,-86.736652,"Home Cleaning, Office Cleaning, Professional Services, Home Services",1
nzdgxHXQqehdjfv-SeWUxQ,Nashville,TN,36.13637,-86.78901,"Specialty Food, Juice Bars & Smoothies, Food, Health Markets",35
etKU5QwF2LQJpNFO2Dc46A,Nashville,TN,36.1767806,-86.7897618,"Fashion, Shopping, Men's Clothing, Accessories, Women's Clothing",18
inpHHalmEPkTMBg9yOWfLg,Nashville,TN,36.1595251574,-86.7745297602,"Seafood, American (New), Steakhouses, Diners, Breakfast & Brunch, Restaurants",719
uIWFz_omO_24o1voopJwvw,Nashville,TN,36.1012966181,-86.7400689888,"Beauty & Spas, Hair Stylists, Barbers, Hair Salons",8
-yfcf2517gmhlwt6Jf-noQ,Nashville,TN,36.1262476863,-86.8465074325,"Fitness & Instruction, Trainers, Active Life, Barre Classes, Pilates",68
M1w-dOmbD0OjM5T0tLtiJg,Nashville,TN,36.15208,-86.85183,"American (New), Health Markets, Vegan, Cocktail Bars, Restaurants, Bars, Breakfast & Brunch, Juice Bars & Smoothies, Food, Specialty Food, Nightlife",105
NB5XTBuLVCn7c9Lu5SUqKg,Nashville,TN,36.1577208,-86.7885843,"Gastropubs, Restaurants, Nightlife, Southern, Bars, Indian",1230
QSdvLjLTUljSxT_uH9szcg,Nashville,TN,36.1658550004,-86.7798792617,"Hair Salons, Hair Removal, Barbers, Nail Salons, Beauty & Spas, Skin Care, Tanning, Eyelash Service, Hair Stylists, Massage, Day Spas",67
i6Sb4Gm5O-w1rtVZWwzbyA,Nashville,TN,36.1085975,-86.8133626,"Acai Bowls, Food, Juice Bars & Smoothies, Vegetarian, Restaurants",133
63wsqoXuGgehnuGrTW4y7g,Nashville,TN,36.1590990661,-86.7750539509,"Food, Restaurants, Southern, American (New)",949
AGR-8zD3EKSF0KgTk72jgA,Nashville,TN,36.1517368703,-86.7931938171,"Arts & Entertainment, Local Flavor",174
larqjPOY5TfoFcQoK_7FgA,Nashville,TN,36.1518751,-86.7990435,"Live/Raw Food, Bars, Nightlife, Desserts, Comfort Food, Cajun/Creole, Food, Restaurants, Cocktail Bars, Seafood",649
wCJVhQkQ5ciOHL2Jrf52Kw,Nashville,TN,36.129676,-86.852495,"Chiropractors, Health & Medical, Acupuncture",2
VKC3yRl10ZfGrjEv-AB5vw,Nashville,TN,36.1318844,-86.7787851,"Hair Salons, Men's Hair Salons, Shopping, Beauty & Spas, Waxing, Used, Vintage & Consignment, Hair Stylists, Barbers, Fashion, Skin Care, Hair Removal",36
