business_id,city,state,latitude,longitude,categories,checkin_count
HA0xwbdbu0pZ5lqPMUFJjA,Nashville,TN,36.1097192,-86.8193683761,"Orthodontists, Dentists, Cosmetic Dentists, Oral Surgeons, General Dentistry, Endodontists, Periodontists, Health & Medical",4
d5ZILTOpR9o3SHM1IV825Q,Nashville,TN,36.0874559,-86.7322171,"Automotive, Tires, Auto Repair",22
e_rHcZom67eE8vepInkxXg,Nashville,TN,36.1482458,-86.7366082,"Restaurants, Italian, Food Trucks, Food",4
j-PDH-l-OVbDhv_XC-HYlA,Nashville,TN,36.1021012,-86.8167829,"Local Services, Dry Cleaning & Laundry, Laundry Services",1
9I7VNu6_VclomWuINtIFaw,Nashville,TN,36.0673339,-86.7190216,"Mexican, Restaurants, Latin American, Seafood",195
mGx3EMJY0SBTWvIKGyM1rQ,Nashville,TN,36.245838,-86.761121,"Shopping, Hardware Stores, Home & Garden, Nurseries & Gardening, Home Services, Building Supplies, Appliances",122
HXBWNj2s4d7Pn0nwNy0ffw,Nashville,TN,36.0783218189,-86.7272680081,"Shopping, Head Shops, Vape Shops, Tobacco Shops",43
8yy8PtUdZv_3XxmmrLNhvw,Nashville,TN,36.1559008,-86.7736471,"Food, Breakfast & Brunch, Restaurants, Burgers, Coffee & Tea",20
LNOE8rK5L6NgcM3A06JJew,Nashville,TN,36.176528,-86.756662,"Food, Breweries, Beer Gardens, Restaurants, Pizza, Nightlife",241
tLVnL8CqQYiMU6E_aayYog,Nashville,TN,36.1824427,-86.7355811,"Restaurants, Nightlife, Vegetarian, Vegan, Bars, Juice Bars & Smoothies, Food, American (New), Cocktail Bars, Breakfast & Brunch, Beer, Wine & Spirits",994
p5WmaHrBD3UbOCbnqKshIg,Nashville,TN,36.1449733,-86.8265054,"Event Planning & Services, Venues & Event Spaces",20
0FIfHHrNbcc_hXbCjhU8HQ,Nashville,TN,36.1426042282,-86.8017755985,"Food, Coffee & Tea, Sandwiches, Health & Medical, Hospitals, Restaurants",167
AOigPFn7rV9WoihHE5zrpQ,Nashville,TN,36.1445685,-86.8137423,"Sporting Goods, Shopping, Bikes",7
Qp5tkcwhe-xdACTKybWaEQ,Nashville,TN,36.1034773,-86.8171841,"Beer, Wine & Spirits, Food",0
_KiEYa2h6frmrTNv-75VaQ,Nashville,TN,36.1281258,-86.8403874,"Home Services, Real Estate, Apartments",1
-yAUuuXOO-_-kacgsyO9Kw,Nashville,TN,36.17,-86.78,"Life Insurance, Financial Services, Insurance",1
fk2vQay1Y2W-L7S85Y93yQ,Nashville,TN,36.1454919,-86.8705297,"Auto Parts & Supplies, Automotive",15
f8WKIeT7HMAOedo54Nrd7Q,Nashville,TN,36.1410498619,-86.8404972553,"Barbeque, Cocktail Bars, Bars, Nightlife, Restaurants, Southern",405
AYRJ0gVj9x394Vxzc-6-1g,Nashville,TN,36.1637492849,-86.7802137776,"Beauty & Spas, Massage, Massage Therapy, Health & Medical",4
hT5P-A_an13Yy2vJdwOzaw,Nashville,TN,36.1614,-86.774559,"Arts & Entertainment, Nightlife, Arcades, Dive Bars, Bars",368
56Jvuoxhig_Qh0jFnLbGMw,Nashville,TN,36.262432,-86.713682,"Beauty & Spas, Nail Salons",4
vK69YN9LtxNP25YAfQKUhw,Nashville,TN,36.136242,-86.723976,"Hotels & Travel, Hotels, Event Planning & Services",2
I4GXcmX8XVIdKKVIxGRQSw,Nashville,TN,36.2200489,-86.7276254,"Automotive, Auto Repair",0
n2I9f9qWCMVVngqV5h3ILw,Nashville,TN,36.044314,-86.7124118,"Dentists, Health & Medical",3
hFLBk8vwjeQOtAeK6hwM8g,Nashville,TN,36.1416389,-86.8411597,"Laundry Services, Local Services, Dry Cleaning & Laundry",47
mJk551wWLMMUx0CYoZ7uyQ,Nashville,TN,36.1693388,-86.6784856,"Burgers, Food, Restaurants, Ice Cream & Frozen Yogurt, Shopping, Fashion, Sandwiches, Department Stores",86
9K8U6ERid3Ubg-P_4svs7w,Nashville,TN,36.1678175235,-86.7823123357,"Museums, Arts & Entertainment, Venues & Event Spaces, Event Planning & Services",153
w9grvGu-5bHNucOeReHzfA,Nashville,TN,36.1249635,-86.7891047,"American (New), Restaurants, Nightlife, Bars, Cocktail Bars, Steakhouses, Southern, Seafood",1586
31oc95cX9zQPHVvRMvSFCQ,Nashville,TN,36.0842504,-86.7291158,"Chinese, Restaurants",22
W_mZGJmPRkZ7ncQTxSVgKA,Nashville,TN,36.1517442,-86.7874301,"Health & Medical, Massage Therapy, Day Spas, Beauty & Spas, Skin Care, Massage",46
jJSgDuY9sLzUfZ91_YSCog,Nashville,TN,36.157565314,-86.7914268112,"Restaurants, Thai, Noodles",11
vwYJXWstAj3frLT-w5cS_g,Nashville,TN,36.039442,-86.742921,"Mobile Phones, Shopping, Local Services, IT Services & Computer Repair, Telecommunications, Electronics, Mobile Phone Accessories",11
1ByZRHC-Vg2Z9-QAxxbwcA,Nashville,TN,36.1648669,-86.7785727,"Restaurants, Burgers, Sandwiches, Delis",3
1NYbb6BzNjEyUwFKc9UfZw,Nashville,TN,36.1313394921,-86.7450713118,"Bars, Arts & Entertainment, Arcades, Venues & Event Spaces, Event Planning & Services, Nightlife",42
vV5OzGHmTdcxNoLzXH_q1Q,Nashville,TN,36.2366462,-86.758686,"Hotels, Event Planning & Services, Hotels & Travel",5
vpHso5Rw346lqdahJCzaow,Nashville,TN,36.1078097117,-86.8158851982,"Salad, Restaurants, Vegetarian",18
iJ9DmDernXO7x0WMw4MKfA,Nashville,TN,36.1057818,-86.8131938,"Bakeries, Restaurants, Custom Cakes, Food",0
_cxUjtKO2aaBGeR0u6-7vg,Nashville,TN,36.1365972259,-86.8848641987,"Mobile Phones, Mobile Phone Accessories, Telecommunications, IT Services & Computer Repair, Local Services, Shopping",5
JIL_wYOecf1c1N0l5bP-4Q,Nashville,TN,36.2165427,-86.8571659,"Tree Services, Home Services, Landscaping",0
_5arUCK9zn1NegiZRxb6Rg,Nashville,TN,36.2051526268,-86.771737,"Automotive, Parking, Gas Stations, Food, Convenience Stores",42
Z6PfUfgXTehdqFil6efMdw,Nashville,TN,36.151602,-86.8540198,"Dry Cleaning & Laundry, Laundry Services, Dry Cleaning, Local Services, Laundromat",10
6nILr9A6ZQJgQIt__j-vSA,Nashville,TN,36.1554753,-86.7805884,"Restaurants, American (Traditional), Cocktail Bars, Nightlife, Bars, Breakfast & Brunch",30
a4PqAlSLQMupOTk2-Hke5A,Nashville,TN,36.109778,-86.726641,"Beauty & Spas, Nail Salons",9
beMGOiI-19QWcB0l5WnhEg,Nashville,TN,36.1049162,-86.8646954,"Southern, Restaurants",0
e7NPtfoNcTbL-ceQBsO0PQ,Nashville,TN,36.1644184,-86.8529587,"Breakfast & Brunch, Sandwiches, Coffee & Tea, Food, Restaurants",44
avivi8rQFEaR9iH_CZ1iBA,Nashville,TN,36.17607,-86.7866964,"American (New), Bars, Seafood, Nightlife, Restaurants",418
TO1g9gLeJf3vqfxfJ1ZG-g,Nashville,TN,36.1569375,-86.7732749,"Hotels, Event Planning & Services, Hotels & Travel",115
1RqfozJoosHAsKZhc5PY7w,Nashville,TN,36.1629634175,-86.7814135551,"Watch Repair, Local Services, Shopping, Jewelry",21
cAWW8h_LXJnT7mtqUDj0Zw,Nashville,TN,36.1893579,-86.7998283,"Local Flavor, Event Planning & Services, Hotels & Travel, Hotels",296
hb6HFSOP8E024h4BFi5zaQ,Nashville,TN,36.115362,-86.7662,"Beauty & Spas, Tattoo",11
j1hghGmDhPPbd0FhwCuTiw,Nashville,TN,36.121831,-86.7900562,"Shopping, Fashion, Accessories, Women's Clothing",61
-p70N-1fbYVz3NSffvd7UQ,Nashville,TN,36.115346,-86.71992,"Food, Middle Eastern, Mediterranean, Restaurants, Grocery",7
h7Fq7pBe2uMD5doA91j6XQ,Nashville,TN,36.1299477995,-86.669794787,"Local Flavor, Nightlife, Lounges, Bars",1305
u7heKYrYeSWF0HIMm9E2Jg,Nashville,TN,36.1394699762,-86.8806180422,"Restaurants, Fast Food, Tex-Mex, Tacos, Mexican, Breakfast & Brunch",43
BG7x-xjIGInPJ_YTD1L56w,Nashville,TN,36.1705586,-86.678578,"Grocery, Photography Stores & Services, Health & Medical, Food, Bakeries, Shopping, Pharmacy, Drugstores",302
WfZmbpwMpAaI8moxTE9iJg,Nashville,TN,36.0992283,-86.7389068,"Automotive, Tires",1
fgAhcqxGZHcC7RtXxYwFeQ,Nashville,TN,36.0809210785,-86.7584823444,"Food, Sandwiches, American (Traditional), Donuts, Restaurants",91
VZbXtbrFqdvgt2eKQbSicQ,Nashville,TN,36.1724885,-86.7805961,"Event Planning & Services, Venues & Event Spaces, Party & Event Planning, Wedding Planning",0
9IutqmrQ2mYqyoR1SdvywQ,Nashville,TN,36.179542,-86.8907545,"Performing Arts, Arts & Entertainment, Event Planning & Services, Venues & Event Spaces",71
CTZEnTsW2JYN2NH1BCAaZw,Nashville,TN,36.1488631,-86.6649254,"American (New), Restaurants, Nightlife, American (Traditional), Bars, Lounges",1207
VvItX6hHEPyOUIGyvrTQCw,Nashville,TN,36.1604967,-86.777479,"American (Traditional), Restaurants, Breakfast & Brunch",125
b7h2tE1o_SasFrHSJg4VsA,Nashville,TN,36.1773038,-86.7458857,"Restaurants, Nightlife, American (New), Bars",9
dtdI5rH7F_7Q1Egc0PLfxQ,Nashville,TN,36.1420998,-86.8006781,"Education, Colleges & Universities",801
2gzSbJNjCr7qvb2KJAAS-g,Nashville,TN,36.1747153,-86.7735685,"Event Planning & Services, Hotels & Travel, Hotels",11
ji_mV3tIdATJhU4i1t0nJQ,Nashville,TN,36.0793466752,-86.9477385727,"Restaurants, Southern, Sandwiches, Salad, Chicken Shop",23
pokS0UOGVKuILWtS1HNLBA,Nashville,TN,36.112401,-86.765567,"Restaurants, American (Traditional), Sports Bars, Chicken Wings, Steakhouses, American (New), Bars, Nightlife, Burgers",203
dsOIK0dCFVQMunTCnbJyXQ,Nashville,TN,36.1073118437,-86.8160727022,"Electronics, Shopping, Books, Mags, Music & Video, Bookstores, Toy Stores",4
KvCmKEV_pL0qMmw3Q8Yagg,Nashville,TN,36.1504218,-86.666106,"Salad, Restaurants, Barbeque, Sandwiches",797
qh-moShar6W8ARKcc9Kq5Q,Nashville,TN,36.2361683,-86.7591177,"Event Planning & Services, Hotels & Travel, Hotels",6
5DDPX5QQS43uACR1MiCVPA,Nashville,TN,36.2037825616,-86.6933882711,"Beer Bar, Music Venues, Desserts, Nightlife, Bars, Arts & Entertainment, Restaurants, German, Food",712
u3HDgfiYsG2XZ3SqZcRv7A,Nashville,TN,36.0727326,-86.9624086,"Home Services, Plumbing",0
MwFLVJ_f_ITjvZI6SRPAdw,Nashville,TN,36.170445,-86.788693,"Indian, Restaurants, Pakistani",67
St_OHgYAn5czLy0naZwseA,Nashville,TN,36.1511997,-86.8015353,"Food Delivery Services, Seafood, Buffets, Ethnic Food, Specialty Food, Vegetarian, Vegan, Restaurants, Food, Indian, Pakistani",781
McE_Yj6-dfRmh3RR3hfVsg,Nashville,TN,36.0767441897,-86.9214401448,"Restaurants, Cafes, Gluten-Free, Sandwiches",51
RKd0lT_ysCRTv8HhFzuk8w,Nashville,TN,36.154729,-86.782348,"Active Life, Boot Camps, Health & Medical, Gyms, Trainers, Fitness & Instruction",122
XiDhSghC-9Hz19hBlLpbyg,Nashville,TN,36.1755799155,-86.7879683514,"Coffee & Tea, Restaurants, Creperies, Food, Nightlife, Beer Gardens",659
eN0btZ1PvSB-65fEpNDmNg,Nashville,TN,36.150652,-86.795183,"Health & Medical, Nutritionists, Food, Juice Bars & Smoothies",6
tE-hkydjOZxCE4TDv1_a5A,Nashville,TN,36.2328356,-86.7582536,"Restaurants, Burgers, Fast Food",16
QSlFP_AwiOsg7sbUhqKQmg,Nashville,TN,36.0715232,-86.6379566594,"Greek, Restaurants",17
WB8LCYxHydct2yIVxLv2GA,Nashville,TN,36.113472,-86.7475712,"Auto Glass Services, Auto Customization, Automotive, Auto Repair, Car Dealers, Body Shops",8
h_UbaqduIhtIQvYV7p2oVQ,Nashville,TN,36.15139,-86.826088,"Restaurants, Chicken Wings, Sandwiches, Pizza",83
5sIIvhfXguTwlzaMKMRqrg,Nashville,TN,36.2146792,-86.7725477,"Movers, Professional Services, Self Storage, Local Services, Home Services",0
DuqAq7XvpakIWlHAk70aXg,Nashville,TN,36.1520399,-86.6274341,"American (Traditional), Bars, Breakfast & Brunch, Restaurants, Sports Bars, Nightlife, Karaoke",37
Vw1PCeLIuLAybwT2zD9mxQ,Nashville,TN,36.048229,-86.7100785,"Food, International Grocery",8
pqol7qMfzBhDvF-3ABTHmg,Nashville,TN,36.2327557,-86.7243679,"Real Estate Agents, Real Estate Services, Property Management, Home Services, Real Estate",0
ZIfvFrdyT1L9mS-NpGhuMA,Nashville,TN,36.041694,-86.745714,"Food, Coffee & Tea, Restaurants",723
EixYg5g2jhR2bSvjpvBNqw,Nashville,TN,36.169916,-86.685233,"Skin Care, Beauty & Spas, Eyelash Service, Nail Salons",80
-RCy49doG-2XARGzr9Do5Q,Nashville,TN,36.122032,-86.7058078014,"American (Traditional), Restaurants, Barbeque, Steakhouses",135
-Rmnq6whZM-ZTp4QjiXmUQ,Nashville,TN,36.0407965,-86.7442304,"Health & Medical, Medical Centers",3
w__UZfNB79VSXmFUWhAVyA,Nashville,TN,36.1501131,-86.8056986,"Japanese, Asian Fusion, Desserts, Sushi Bars, Food, Restaurants, Sandwiches, Burgers",392
hGemtFC-IIn1rk-I6w1oVg,Nashville,TN,36.1262551,-86.8462918,"Fitness & Instruction, Gyms, Trainers, Active Life",496
hhxrgOoLJImsLtPR1d3uJg,Nashville,TN,36.1711484,-86.8010252,"Restaurants, Chicken Wings",79
NpXcjcdZXlAZcnFRtInJ9A,Nashville,TN,36.104923,-86.818884,"Hair Removal, Skin Care, Massage Therapy, Medical Spas, Health & Medical, Day Spas, Massage, Beauty & Spas, Laser Hair Removal",22
hl08hMX01mw2CMCSnzsK-Q,Nashville,TN,36.0897676212,-86.6510624,"Self Storage, Home Services, Musical Instrument Services, Piano Services, Local Services, Movers, Packing Services, Packing Supplies, Shopping",0
KclsUl42Ktpdm749Uo1BMA,Nashville,TN,36.1409689,-86.8399143,"Food, Restaurants, Pizza, Bars, Wine Bars, Italian, Nightlife",51
3r7cGzwXpnMXsiGywbBFiQ,Nashville,TN,36.1782803,-86.7497036,"Fashion, Shopping, Home Decor, Home & Garden, Local Flavor, Women's Clothing, Department Stores",52
QZ5hwpqN_gq6X8jzM1GM3Q,Nashville,TN,36.0775432,-86.7315785,"Automotive, Auto Glass Services, Windshield Installation & Repair, Auto Repair",0
PwbeSKSCBnqXJlAxEaUrnA,Nashville,TN,36.1827471,-86.7352329,"Nightlife, Bars, Restaurants, Dive Bars, Mexican",1560
tbBsWjmbl6zoR5ffGzJ70g,Nashville,TN,36.169471,-86.6813907,"Pet Services, Pets, Pet Stores, Pet Groomers",0
oX1e0xz9C96sk34I1dHjJQ,Nashville,TN,36.0939445,-86.6077363,"Pet Services, Pet Sitting, Animal Shelters, Pets, Pet Boarding, Pet Transportation",0
KIluFreHCsOiP_ZlA9qlHg,Nashville,TN,36.1523805,-86.7893889,"Tours, Hotels & Travel",8
hBN6tfquAdbjj1BLqXtRoQ,Nashville,TN,36.1524194737,-86.8535103892,"Gyms, Interval Training Gyms, Trainers, Fitness & Instruction, Active Life",0
4BOOfN-ZzuzGFR1V46Im9w,Nashville,TN,36.1682704,-86.7829122,"Home Services, Real Estate, Apartments",6
6zoj9_GOPWloZ0VWp9wRSw,Nashville,TN,36.076485,-86.721382,"Health & Medical, Local Flavor, Hospitals, Emergency Rooms, Urgent Care, Doctors, Medical Centers",35
4psm-jktkSmMmrl7R2vwjA,Nashville,TN,36.0409019,-86.7402417,"Restaurants, Pizza, Italian, Sandwiches",27
T_8vxFyFqVUGIprW8n-i6g,Nashville,TN,36.0983315,-86.6561826,"Home Services, Garage Door Services, Hardware Stores, Shopping, Building Supplies, Home & Garden",0
aDgughL1vDootnXe5kUWGQ,Nashville,TN,36.1511805,-86.7833044,"Bars, Ramen, Food, Restaurants, Japanese, Cocktail Bars, Bubble Tea, Nightlife",999
EXfIURX2NtTp_G1Lje3VaQ,Nashville,TN,36.1765612,-86.7508693,"Lounges, Bars, Nightlife, Restaurants, Tex-Mex",0
PUFF2T_DrWI5R3MAD85x2w,Nashville,TN,36.1528177,-86.847523,"Pet Groomers, Pet Services, Pets, Pet Sitting",47
lLPmPzlO5QyuJnEgY8C9Ng,Nashville,TN,36.1608679,-86.7941141,"Automotive, Auto Repair",4
h4lnuvBIEL3wefTe9VozwA,Nashville,TN,36.081993,-86.725357,"Food, Department Stores, Drugstores, Electronics, Discount Store, Fashion, Grocery, Shopping",50
2xpwiOhbDCijw-Fv7_8eDQ,Nashville,TN,36.1861817,-86.7301834,"Automotive, Towing, Auto Repair",15
qepgYnobwEyWr4oAfDDhyw,Nashville,TN,36.1706189,-86.7888584,"Vegan, Mexican, Tacos, Restaurants",12
JZIZwIM5yrHMFByQPwU2IA,Nashville,TN,36.0864821,-86.7305009,"Restaurants, Mexican",112
Sckvwz-t7-oMXh_JNzxg_Q,Nashville,TN,36.1560574,-86.7810672,"Gelato, Bakeries, Coffee & Tea, Food",12
GST3wg-wej15vHeCvaXE6w,Nashville,TN,36.1620156,-86.7744513,"American (Traditional), Bars, Sushi Bars, Restaurants, Nightlife, Beer, Wine & Spirits, Food, Chicken Wings, Event Planning & Services, Venues & Event Spaces",3375
NqSokvlx6gIo5HSHRTZ_6Q,Nashville,TN,36.161406,-86.774562,"Dance Clubs, Nightlife",20
_2FrIA5unwbbweldUnpROQ,Nashville,TN,36.1510663,-86.7814597,"Party Bike Rentals, Event Planning & Services",0
1-D5D54iFZ0JefGeQl3oXw,Nashville,TN,36.0973074,-86.8729328,"Desserts, Food, Ice Cream & Frozen Yogurt",9
tU692E8N0xBQ7Ogc78gN2g,Nashville,TN,36.1770378,-86.7496909,"Sandwiches, Cafes, Coffee & Tea, Tabletop Games, Food, Restaurants, Desserts, Shopping, Bakeries",786
vBoTESFuAMVyzn-bd5vzNA,Nashville,TN,36.1597930664,-86.6635639,"Tree Services, Home Services, Damage Restoration, Landscaping",0
l3E4Z4dQNXeJYnEyxBSSgw,Nashville,TN,36.0881174,-86.6508077248,"Discount Store, Shopping, Food, Beer, Wine & Spirits, Meat Shops, Grocery, Specialty Food, Fruits & Veggies, Organic Stores",13
PkayDXaGkYw68waa8EQ2pA,Nashville,TN,36.164323,-86.778782,"Arts & Entertainment, Cocktail Bars, Bars, Music Venues, Lounges, Nightlife",16
xv44C_vrcRaJNxosgkyRlA,Nashville,TN,36.1525621,-86.8394071,"Automotive, Tires",2
B18nlaHQvEfbMrMHLYnulA,Nashville,TN,36.2349334,-86.7021168,"Home Services, Handyman",0
F6HXplbQ4H3HIwrOj99wpw,Nashville,TN,36.128617,-86.8547433,"Health & Medical, Endodontists, Dentists",3
lnUJXI_NsX8G4HX8jrVDag,Nashville,TN,36.1421,-86.701137,"Hotels, Hotels & Travel, Event Planning & Services",305
yOc3BbR4pua-7El5ce8lHg,Nashville,TN,36.2006441304,-86.7394191725,"Food, Restaurants, Coffee & Tea, Burgers, Fast Food",137
iTgT6bsgL64BCx96MNZngA,Nashville,TN,36.1443218,-86.750614,"Used Car Dealers, Automotive",0
HQ2etQ9En-Jb6OmQWM8HjQ,Nashville,TN,36.0480927,-86.710217,"Restaurants, Diners",4
-vHghm3-jwjybRJKBbSYWA,Nashville,TN,36.1442003,-86.8139711,"Shoe Stores, Shopping, Fashion, Women's Clothing, Accessories",14
VutZTcoSaioI3-X5Z5TurA,Nashville,TN,36.1401339,-86.742326,"Motorcycle Repair, Automotive",7
UBCOE-7SXWrg2kPLSuF4YQ,Nashville,TN,36.1366687,-86.8000174,"Pizza, Restaurants, Salad",31
pG3BViWKznBrEPlbV9wxPA,Nashville,TN,36.153143,-86.78348857,"Restaurants, Nightlife, American (New), Cocktail Bars, Sandwiches, Bars, Gastropubs, Sports Bars",993
x1pwGxuVvJ3shY6SfvuJBQ,Nashville,TN,36.1709672213,-86.8771952391,"Garage Door Services, Home Services",0
OtLo6a-20k01NDubRme17w,Nashville,TN,36.1537279,-86.7973851,"Restaurants, American (New)",52
7XV4P1YmQo1zOyfp-gh97A,Nashville,TN,36.203081,-86.691785,"Food, Caterers, Flowers & Gifts, Event Planning & Services, Specialty Food, Desserts, Shopping, Macarons, Gift Shops, Bakeries",10
4uc7huVjfw0fjEgwd3Lpcg,Nashville,TN,36.081124,-86.948527,"Restaurants, Thai, Asian Fusion, Sushi Bars",84
uOD0VKnYepJlWSSebPg0hw,Nashville,TN,36.1577057,-86.6641778,"Motorcycle Repair, Sporting Goods, Automotive, Hardware Stores, Motorcycle Dealers, Home & Garden, Shopping, Active Life, Jet Skis",5
BgN4BaKX1VJJuexYFJxUOQ,Nashville,TN,36.1607147,-86.7854007,"Movers, Home Services, Local Services, Self Storage",0
8njTcZKsdTQOjfvth5G4gQ,Nashville,TN,36.179822,-86.81058,"Restaurants, Chicken Wings",1
_e4WVUkLJkIcfeA24VQBqA,Nashville,TN,36.2269486,-86.7377402,"Shopping, Educational Services, Musical Instruments & Teachers, Education, Arts & Entertainment, Performing Arts",0
19bKEfriuMkKbLGmdw_lbw,Nashville,TN,36.1199321,-86.7360777,"Packing Services, Home Services, Self Storage, Local Services, Movers, Automotive, Truck Rental",0
WkeCW0WCOKjZj4G2TuEdVA,Nashville,TN,36.0765899,-86.9498815,"Restaurants, Fast Food, Italian, Pizza, Chicken Wings",0
lqrY1tHhPkZsiOPfpoydvw,Nashville,TN,36.1854487,-86.7481273413,"Fast Food, Burgers, Restaurants",143
KsRzKjheTLSUk1ULybbOIw,Nashville,TN,36.04592,-86.712783,"Burgers, Restaurants, American (Traditional), Hot Dogs, Fast Food",54
U5rOYzO9vnMk0B175_e29w,Nashville,TN,36.1254525,-86.7891142,"Local Services, Laundry Services, Dry Cleaning & Laundry",4
Mm5rQS6FJ4eREcfVq0KYww,Nashville,TN,36.1461644341,-86.8088584785,"Restaurants, Tex-Mex, Mexican",153
puudMDcIOGEXIZLHH0GU8Q,Nashville,TN,36.1523927157,-86.7978435693,"Shopping, IT Services & Computer Repair, Mobile Phones, Mobile Phone Accessories, Local Services, Telecommunications",21
tAVOiCKEh9AsirL7mgxR6Q,Nashville,TN,36.0684254577,-86.6841327706,"Beauty & Spas, Hair Salons",19
dU70ja7ZfhHvA6o2LziBkA,Nashville,TN,36.1740566,-86.7510952,"Shopping, Accessories, Fashion, Women's Clothing, Men's Clothing",11
q8sati4rCaPAhT8eRg-UBQ,Nashville,TN,36.150602,-86.793422,"Personal Shopping, Fashion, Shopping, Used, Vintage & Consignment, Women's Clothing",12
oJvOiVyzqWqOfvaRH_TflA,Nashville,TN,36.1521910213,-86.7762813111,"American (Traditional), Restaurants, Bars, Wineries, Event Planning & Services, Music Venues, American (New), Nightlife, Wine Bars, Food, Mediterranean, Arts & Entertainment, Venues & Event Spaces",609
0IcEAPMDFDVJ8d2UvYOkEw,Nashville,TN,36.0436225,-86.7121846,"Restaurants, Food, Sandwiches, Salad, Desserts, Greek",49
9Gt-iO5Nrr7wUB03uawpLw,Nashville,TN,36.1030036,-86.8722146,"Pet Sitting, Pet Services, House Sitters, Home Services, Pets, Dog Walkers",4
5dtNc-kauiPwdrLNZbCqvg,Nashville,TN,36.162341,-86.7808979,"Do-It-Yourself Food, Caterers, Food, Event Planning & Services",26
ulLCPjmygwiWgqxRBMoXaQ,Nashville,TN,36.1314892,-86.6692337,"Hotels & Travel, Car Rental",10
Md_VzsLnsOwtWKq1vheaxA,Nashville,TN,36.05008,-86.647077,"Pizza, Restaurants",0
zwTeKW4iQgjBklEi-kaKpQ,Nashville,TN,36.0601436,-86.7165159,"Restaurants, American (Traditional)",3
Wp64GwykwZ-9cnYHb3bwEg,Nashville,TN,36.0990732,-86.8222593,"General Dentistry, Cosmetic Dentists, Health & Medical, Endodontists, Dentists",4
JPoLb8jZYc5e7WjI2coVkQ,Nashville,TN,36.1314659,-86.7785911,"Asian Fusion, Vietnamese, Restaurants",1019
zB6YGDKwRC8oiaEu3_Tieg,Nashville,TN,36.1772259,-86.7511639,"Beer, Wine & Spirits, Food",269
7gvhTYbmnyAiGuG-TRlf8A,Nashville,TN,36.0246887866,-86.7117529742,"Restaurants, Japanese, Sushi Bars",274
EI_vnL8ZCWBcsmD9_97iKg,Nashville,TN,36.104219,-86.815897,"Makeup Artists, Skin Care, Shopping, Cosmetics & Beauty Supply, Beauty & Spas, Nail Salons",4
KtIuUYABc3KsTi3mOnYW4A,Nashville,TN,36.2241626,-86.7252269,"Barbers, Beauty & Spas, Waxing, Hair Removal, Nail Salons, Hair Salons, Nail Technicians, Hair Stylists",109
OWOOc0YjU_kioLeEgo5VCA,Nashville,TN,36.035175,-86.972013,"Food, American (Traditional), Arts & Entertainment, Southern, Nightlife, Restaurants, Breakfast & Brunch, Music Venues",3727
Lc8gLdf9rg5wr8HqjPXFxA,Nashville,TN,36.1499078572,-86.8057418615,"Skin Care, Hair Salons, Beauty & Spas, Hair Extensions",11
bdVdOSGtXAwCRNcKoUyEDA,Nashville,TN,36.219891677,-86.7046765665,"Hotels, Vacation Rentals, Hotels & Travel, Resorts, Event Planning & Services",150
OtUGzng5qnvqZQ0CRwd4Pw,Nashville,TN,36.1689588912,-86.5136261771,"Movers, Home Services",0
NQwPRQed1mJCOss6LXSu9Q,Nashville,TN,36.167361,-86.658674,"Carpet Cleaning, Home Services, Carpeting, Local Services",0
YkPGsrnK1sx7cjBYRUl9Ig,Nashville,TN,36.164224,-86.778734,"Karaoke, Bars, Dive Bars, Nightlife",122
po6K5MPrYRt4NsELkNQv7Q,Nashville,TN,36.2486429,-86.7569601,"Automotive, Smog Check Stations",20
E1JzWGfff3qQ6TA-HU8EwA,Nashville,TN,36.1887005523,-86.7728814483,"Sewing & Alterations, Shoe Shine, Laundry Services, Local Services, Dry Cleaning & Laundry",17
m09iBkbC5d6S5oq-iLhBjg,Nashville,TN,36.1079348512,-86.8192760735,"Chiropractors, Health & Medical",2
I0kDl8mhBj3xfn2Yhb4L-g,Nashville,TN,36.1419283,-86.8155617,"Real Estate, Home Services, Apartments",2
CTYMtDTGxMRFpgSfcuAFHA,Nashville,TN,36.16952,-86.680982,"Gluten-Free, Vegan, Restaurants",110
meO0mw7buJvgLE2S8qd9WA,Nashville,TN,36.0452581,-86.7156465,"Mobile Phones, Shopping, Local Services, IT Services & Computer Repair, Mobile Phone Repair, Electronics Repair",5
iSg8e_-gD5swdIh2oe-86A,Nashville,TN,36.1525641,-86.8234069,"Auto Parts & Supplies, Auto Repair, Transmission Repair, Auto Glass Services, Smog Check Stations, Automotive, Oil Change Stations",2
nlBbduGlFLoHMQ1Icln3Nw,Nashville,TN,36.1518857668,-86.8049137294,"Coffee & Tea, Food, Coffee Roasteries, Food Trucks",1
OFbbu2OUMxW9vomQxUy6GQ,Nashville,TN,36.2094255599,-86.7341060305,"Restaurants, Pizza",2
VuubVgCDC4rbvF_iPIhh1A,Nashville,TN,36.1639486,-86.7759807,"Desserts, French, Breakfast & Brunch, Restaurants, Food, Italian, Creperies",15
Km22RY-OGPIV8-DULV-oZQ,Nashville,TN,36.2955295,-86.6986547,"Urgent Care, Health & Medical",3
gVU0U7gNBMQxKTzqmRtdLg,Nashville,TN,36.1606894036,-86.7772081877,"Burgers, Steakhouses, American (New), Chicken Wings, Barbeque, American (Traditional), Sandwiches, Restaurants, Nightlife, Bars, Pubs",3233
lzo5vrmcxGcsyPMaGrnQVg,Nashville,TN,36.1527508,-86.795497,"Hotels, Hotels & Travel, Event Planning & Services",361
G9_MiGNofTuwpOp9at5qSQ,Nashville,TN,36.1734674601,-86.7631131685,"Active Life, Gyms, Circuit Training Gyms, Cardio Classes, Fitness & Instruction",1
VbaVZyHusA9W72lIoDDZzw,Nashville,TN,36.152298,-86.6286172,"Hotels & Travel, Event Planning & Services, Hotels",83
9d5saeqjLfkInGItJb1IIA,Nashville,TN,36.1977942,-86.7420852,"Local Flavor, Seafood, Restaurants, Southern",37
cs0_UUYz9r4k_N-HizBxDg,Nashville,TN,36.1448738,-86.8067804,"Stadiums & Arenas, Arts & Entertainment",147
mOekUyNOXxoA9TsxxT8gHQ,Nashville,TN,36.137564,-86.794595,"Trainers, Active Life, Gyms, Fitness & Instruction, Barre Classes, Boot Camps",30
wbaeORfUCcxkwdh7mNapRg,Nashville,TN,36.171247,-86.7825,"Cooking Classes, Cooking Schools, Paint & Sip, Arts & Crafts, Shopping, Party & Event Planning, Event Planning & Services, Arts & Entertainment, Art Classes, Education, Team Building Activities, Specialty Schools, Art Supplies",14
9reMH8QAnhuic3j-_4AcWg,Nashville,TN,36.0926216,-86.6538607,"Home Services, Real Estate, Apartments",2
4TsGea1wyy71w-3Uh8G5mQ,Nashville,TN,36.1461513807,-86.6929030573,"American (Traditional), Restaurants, Nightlife, Sports Bars, Bars",4
qfFTOB1A0yhQA9mXFVSUBw,Nashville,TN,36.1379796,-86.800519,"Banks & Credit Unions, Financial Services",46
lxFULtOIRiPM0hAde69A1A,Nashville,TN,36.2079989,-86.838073,"Shopping, Thrift Stores",0
gs4FtLR-b06Z3GCYTE4K8Q,Nashville,TN,36.108982,-86.813148,"Arts & Entertainment, Art Galleries, Home Services, Home & Garden, Shopping, Building Supplies, Arts & Crafts, Home Decor, Framing, Art Supplies",5
p_uO-Fx34btux3z_-k2J2g,Nashville,TN,36.125509857,-86.7562113,"Windshield Installation & Repair, Windows Installation, Automotive, Home Services, Auto Glass Services, Glass & Mirrors",3
jq1sW8Exy-RMG0Pgv1b7PQ,Nashville,TN,36.1446097,-86.7793791,"Shopping, Motorcycle Dealers, Arts & Entertainment, Automotive",7
fuzRm1ATYtGHdH_fF3OvVw,Nashville,TN,36.1439337162,-86.8130380479,"Chiropractors, Health & Medical",32
kIP1M4CnnfLhYiic4Je9Xw,Nashville,TN,36.1583982,-86.8485814,"Automotive, Body Shops",1
7k1xeYYZc16xhutIWAaDjA,Nashville,TN,36.0801013419,-86.9531533791,"Nail Salons, Beauty & Spas",1
4lwesYimP6HXbYGCL4cXdA,Nashville,TN,36.1244798,-86.8497679,"Jewelry, Watch Repair, Jewelry Repair, Shopping, Local Services, Health & Medical, Optometrists",10
UWdIwAd-HWDt-627tdNpBg,Nashville,TN,36.0700664,-86.7211048,"Fruits & Veggies, Specialty Food, Food",9
Z0hi1FSC4Dmo6-8l6DdN_g,Nashville,TN,36.149933,-86.806159,"Real Estate Services, Real Estate, Home Services, Apartments, Commercial Real Estate",15
dP4KBHqspn2jFhOq_KbtKA,Nashville,TN,36.07365,-86.922198,"Restaurants, Mexican",119
WsXilzHbcR9fUoNjTZhUXA,Nashville,TN,36.1066484948,-86.9227812712,"Restaurants, Sandwiches, Fast Food",19
