business_id,city,state,latitude,longitude,categories,checkin_count
OZ3rsokaA6sFj7jq18DbfA,Nashville,TN,36.092122,-86.651171,"Dentists, General Dentistry, Oral Surgeons, Health & Medical, Prosthodontists, Cosmetic Dentists",2
axBvAzrXqRx2kKadwg87sQ,Nashville,TN,36.0799221678,-86.9496302712,"Breakfast & Brunch, Restaurants",45
fmF58w_cI8Ef-WAIGM3-QA,Nashville,TN,36.1085523,-86.812962,"Restaurants, Seafood, Italian",393
jzdHH9Klvhca6RKCs2_EVg,Nashville,TN,36.103993,-86.818233,"Gyms, Trainers, Active Life, Fitness & Instruction",9
3Dn_fT7NxzKhjy-yNrfIzw,Nashville,TN,36.2186645,-86.6939573,"Sandwiches, Southern, American (New), Nightlife, Bars, Steakhouses, Restaurants, Burgers",190
Fr4HGxz8_s8BxY_fZdadzQ,Nashville,TN,36.204681,-86.7238969,"Grocery, Food, Restaurants, Delis",739
j-cfAX-YZJ9i0bfby2kw5g,Nashville,TN,36.1571955195,-86.776002433,"Coffee & Tea, Food",345
08kVZ7eYC9NGn6njjsRkQA,Nashville,TN,36.157745,-86.7883547037,"Asian Fusion, Restaurants, Chinese",248
DwxMfYlv9L7HQEwCaiw2Xw,Nashville,TN,36.1532782,-86.7960217,"Chinese, Restaurants",124
WDT18nI5VIOI1b7z1G7_LQ,Nashville,TN,36.1202459,-86.7759832,"Chicken Shop, Restaurants, Fast Food",46
Y8kcDm5YN0exd1ndHDIq7g,Nashville,TN,36.170064,-86.6655607,"Books, Mags, Music & Video, Shopping, Toy Stores, Hobby Shops, Comic Books",107
S2n_06z4lGLZfdJ53XAXQQ,Nashville,TN,36.159155872,-86.7751615038,"Desserts, Wine Bars, Restaurants, Event Planning & Services, Seafood, Food, Nightlife, Bars, Middle Eastern, Venues & Event Spaces, Asian Fusion, Mediterranean, American (New), Salad",1457
67r7kra1IDo_SwsvBH9AmQ,Nashville,TN,36.1528134,-86.7913121,"Property Management, Real Estate, Home Services",0
AVZAi-dnenKf71x1NspEVQ,Nashville,TN,36.1841162977,-86.7895186491,Public Services & Government,5
xBJNrbrYzitslbqxKvR8Xg,Nashville,TN,36.1210809,-86.6302262,"Painters, Shopping, Home Services, Handyman, Contractors, Kitchen & Bath, Electricians, Plumbing, Home & Garden, Drywall Installation & Repair, Flooring",0
deuW47tq8mpHN7R_vJ90ew,Nashville,TN,36.1482458,-86.7366082,"Contractors, Home Services, Real Estate Agents, Real Estate Services, Real Estate",0
_PimUuB2peKeBdwxOUz9Tw,Nashville,TN,36.1111019,-86.7432676,"Libraries, Public Services & Government",17
f9qNygjcQvh2vPmZSfEvqg,Nashville,TN,36.1133274,-86.7678555,"Cafes, Vegetarian, Restaurants, Vegan",754
DJFsYreEPhKYNSaJfGe-AA,Nashville,TN,36.1770729,-86.7490034,"Used Bookstore, Shopping",6
LC08Sqjzbx0XadTBQGbTNw,Nashville,TN,36.0592679,-86.6706077,"Donuts, Caterers, Event Planning & Services, Food, Desserts",1
31aaxF3zArOtwsbYTBp25A,Nashville,TN,36.1780018,-86.7508693,"Beauty & Spas, Tattoo",45
YvBGiNf-lPJg68RyKBsq2g,Nashville,TN,36.1045311,-86.816485,"American (Traditional), Barbeque, Southern, American (New), Bars, Restaurants, Pubs, Nightlife",285
WDjVJQr9UEHjZhYXcjjedg,Nashville,TN,36.0444859929,-86.6633973003,"Sandwiches, Ethnic Food, Food, Specialty Food, Restaurants, Salad",4
7M8uWd8mH1k10GWDiOEB-A,Nashville,TN,36.16436,-86.779637,"Ice Cream & Frozen Yogurt, American (Traditional), Food, Burgers, Juice Bars & Smoothies, Restaurants",75
KsUeHP3E0fmICycuIclv0g,Nashville,TN,36.155069,-86.7825589,"Bridal, Shopping",0
Er2OGMsnT65gXg5zjq6X_g,Nashville,TN,36.1041453171,-86.9256340608,"Home Services, Apartments, Real Estate",1
ZgTTgmTq3WyLr4GEJZeGGg,Nashville,TN,36.0745745249,-86.9216505248,"Hair Removal, Waxing, Nail Salons, Beauty & Spas",43
ShBW2Fx5RvPqYxwRDQAfZA,Nashville,TN,36.164344,-86.779976,"Caterers, Restaurants, Event Planning & Services, Pizza",245
ZaVp3xb100ffPhljOD5Pug,Nashville,TN,36.2094958,-86.7336883,"Food, Beer, Wine & Spirits",230
sg3z6IuLkK0CfEwSGAlzYw,Nashville,TN,36.151919,-86.80413,"Restaurants, Italian, Pizza",82
O7LXAi6Q9OOKiNEuJWX_3g,Nashville,TN,36.1284664,-86.7778259,"Real Estate, Home Services, Apartments",129
3hQn3SGdZckitNleWMAXZw,Nashville,TN,36.1758266,-86.7583373,"Yoga, Fitness & Instruction, Active Life",68
pdPzrcPw9mKwAXVNcnNJTQ,Nashville,TN,36.1450089,-86.6871864,"Hotels & Travel, Event Planning & Services, Hotels",244
MMe-OJeHIgRTulqKPJ-QVg,Nashville,TN,36.0468807849,-86.715089712,"Restaurants, Sandwiches, Fast Food",22
LHbe0IbGTDtFyGt7Wo7_cQ,Nashville,TN,36.10333,-86.817874,"Shopping, Accessories, Fashion, Women's Clothing",8
NGLYdoIm9y4ZNqkFe3O76A,Nashville,TN,36.1295742,-86.8020442,"Real Estate Services, Real Estate Agents, Real Estate, Apartments, Home Services",1
L3IMug1NZOITEwNoDz8JAA,Nashville,TN,36.1758211,-86.7863666,"Restaurants, Chicken Shop",141
MLn19rBl5JZUqwWKHoy6MA,Nashville,TN,36.0839712,-86.703729,"Pets, Veterinarians",12
XJZfCBVlhiapUDlBQs2DKw,Nashville,TN,36.1640072,-86.778751,"Cocktail Bars, Breakfast & Brunch, American (Traditional), American (New), Wine Bars, Restaurants, Food, Gastropubs, Beer, Wine & Spirits, Nightlife, Bars, Beer Bar",160
5rXu7H5mjNFQjAV9MRTxyw,Nashville,TN,36.144234,-86.6860519,"Hotels & Travel, Event Planning & Services, Hotels",11
JSffq0bHAr0jMPjMCOvoNw,Nashville,TN,36.0702234,-86.7229718,"Auto Repair, Automotive",54
7FkR-sRbgdpQYRiyq6DKSw,Nashville,TN,36.1921314767,-86.7450350237,"Men's Clothing, Women's Clothing, Used, Vintage & Consignment, Shopping, Fashion",18
RQ8l5G3e4lYhkW6GqiB5-g,Nashville,TN,36.1512053,-86.7214979,"Roadside Assistance, Automotive, Auto Repair, Towing",1
ph0PF2BSaRI-R2f1gmpJuQ,Nashville,TN,36.1314892,-86.6692337,"Massage, Beauty & Spas",72
R61d9MzmVz6IQxote7OoTQ,Nashville,TN,36.1726513,-86.7946089,"Food, Desserts",38
hRoAl3MoV3_D9W9Vi7x3ZA,Nashville,TN,36.1268134,-86.789193,"Restaurants, American (New)",521
btav3zIj7aZYCU910qJkdQ,Nashville,TN,36.1084578,-86.8191358,"Oral Surgeons, Health & Medical, Cosmetic Dentists, Dentists, General Dentistry",10
1f4iuPT4B2BHm_GvjYjQCQ,Nashville,TN,36.0947265491,-86.73736,"Fish & Chips, American (Traditional), Seafood, Restaurants, Fast Food",16
bCJ4kVqNKqJ4EWk1p6-Hdg,Nashville,TN,36.1759707,-86.7865847,"Shopping, Home & Garden, Home Decor, Candle Stores, Flowers & Gifts",5
Xmgbx0LZOkX59sysKQjAAw,Nashville,TN,36.1523805,-86.7893889,"Car Wash, Automotive, Auto Detailing",3
LJhg4i8-DqTg0hPob8aH9w,Nashville,TN,36.1041105,-86.8127012,"DUI Law, Lawyers, Professional Services, Criminal Defense Law",0
hTNHfJi2ZflmLna6hlh7Xg,Nashville,TN,36.1018074,-86.818543,"Shopping, Jewelry",0
wP2ok4O0GsR9td7Iiv1zKA,Nashville,TN,36.0477024019,-86.7149514342,"Beer Bar, Sandwiches, American (Traditional), Nightlife, Latin American, Cafes, Food Trucks, Restaurants, Food, Specialty Food, Coffee & Tea, American (New), Burgers, Bars",570
42IEHcBbEv2dJ3xTi4TCUg,Nashville,TN,36.1018074,-86.818543,"Beauty & Spas, Tanning, Tanning Beds, Spray Tanning",21
QY2wp_GmKgVv4dBwFj5f4Q,Nashville,TN,36.157625,-86.6342714,"Ear Nose & Throat, Doctors, Health & Medical",0
fdhHca_8iqgvumzvKLE6WQ,Nashville,TN,36.1465302,-86.7933334,"Nightlife, Dive Bars, Music Venues, Bars, Arts & Entertainment",111
je7_33s1jsVxc7vbRdow3A,Nashville,TN,36.1246354832,-86.8494859972,"Shopping, Tobacco Shops",8
r72gJkUejA3rcykSz2MVMQ,Nashville,TN,36.1554753,-86.7805884,"Bars, Lounges, Nightlife",181
XsI4wWHsStJQPNn3Lj-okw,Nashville,TN,36.12763,-86.753504,"Auto Glass Services, Auto Repair, Windshield Installation & Repair, Automotive",8
XbqfU1PcwiYZK3GReV40Yg,Nashville,TN,36.104932,-86.812278,"Massage Therapy, Day Spas, Skin Care, Beauty & Spas, Massage, Health & Medical",20
sRzkPGaG_5Ak6thDySRFXA,Nashville,TN,36.1450704,-86.7878778,"Home Services, Masonry/Concrete, Landscaping, Landscape Architects, Gardeners, Contractors, Artificial Turf",0
Kv04mUsfP557B0ECYZkKBQ,Nashville,TN,36.1690932117,-86.8069923724,"Restaurants, Chicken Shop, Fast Food",84
QRzaTTTE7QrqjW2GOQIrtA,Nashville,TN,36.160499,-86.800702,"Sandwiches, Restaurants, Vegan, Gluten-Free, Breakfast & Brunch, Vegetarian",134
dJWzRFAGnzWgn5k3m8NMOA,Nashville,TN,36.2130528,-86.7265483,"Home Services, Electricians, Plumbing, Heating & Air Conditioning/HVAC",0
mgaxmxvk0HvAAUqXNGI5Mg,Nashville,TN,36.1902481,-86.7451243,"Grocery, Food",3
QbPVaZLvIoFS-ODF8aVTkQ,Nashville,TN,36.0775432,-86.7315785,"Food Stands, Restaurants",3
FnC4STqkKbJElkwsRX20TQ,Nashville,TN,36.163462,-86.775807,"Arts & Entertainment, Bars, Nightlife, Performing Arts, Cabaret, Strip Clubs, Music Venues, Striptease Dancers, Adult Entertainment",5
1M8W2HVRV7-Hi7cw7Ini4Q,Nashville,TN,36.1515852663,-86.79441154,"Hotels & Travel, Event Planning & Services, Hotels",128
2fsv9-fFFRjt7yY_kilrEg,Nashville,TN,36.129248,-86.855363,"Mediterranean, Restaurants, Greek",28
KIdpAMqxvjZcdBxrcXB1aw,Nashville,TN,36.1700257,-86.6779815,"Pet Sitting, Emergency Pet Hospital, Pet Services, Pets, Veterinarians",3
_2yIGMTipDG5bebyj9tINg,Nashville,TN,36.153066,-86.8274088,"Car Rental, Hotels & Travel",4
HI8C83cLB8VgYWuNBLR4CQ,Nashville,TN,36.1526125,-86.7887644,"Event Planning & Services, Hotels & Travel, Hotels",63
T3B6WoqOGds6voz029CSJg,Nashville,TN,36.1513512223,-86.7807502757,"Nightlife, Dance Clubs, Bars, Wine Bars",17
jZd462wsUBOIB60UEjUOsw,Nashville,TN,36.1514391,-86.7827159,"Coffee & Tea, Food, Restaurants, Breakfast & Brunch",1615
WuYX1H39-MXDn-P-Tb_OKQ,Nashville,TN,36.059651,-86.740823,"Home Services, Real Estate, Apartments",5
e_QIzqNEwXn5SwN8_yzfBg,Nashville,TN,36.1262642,-86.8052572,"Travel Agents, Travel Services, Hotels & Travel, Financial Services, Insurance",11
neuEVClsC0wp6Hm9IXPu6Q,Nashville,TN,36.0262993263,-86.7134141922,"Restaurants, Sushi Bars",200
o8H4fliNg1FYqw6noUzZzA,Nashville,TN,36.1769521,-86.7457429,"Tex-Mex, Karaoke, Nightlife, Restaurants, American (New), Bars, Gay Bars",385
gGK9oTurV0N5UxPGUs3_sw,Nashville,TN,36.1780225,-86.7862881,"Restaurants, American (New)",70
uDtb534CgCUZg1qmWcUW7w,Nashville,TN,36.1426916,-86.7916654,"Fashion, Women's Clothing, Shoe Stores, Accessories, Men's Clothing, Shopping",38
7chAWF5fbqfyEmLLMoe8Ig,Nashville,TN,36.1773619,-86.7750409,"Automotive, Truck Rental",3
8xAa50YbwlE53F652Ru_Nw,Nashville,TN,36.1502502663,-86.6266698427,"Chinese, Restaurants",47
2qbliuh3JhUrIan0xMwpeQ,Nashville,TN,36.072075678,-86.636965023,"Financial Services, Banks & Credit Unions, Home Services, Mortgage Brokers, Real Estate",14
0q7mz6LcR3LLnLiPY51ZBQ,Nashville,TN,36.1629956,-86.780608,"Lounges, Cigar Bars, Pubs, Cocktail Bars, Shopping, Bars, Tobacco Shops, Nightlife",71
l_QzbDne8lyXpzUyONuKHQ,Nashville,TN,36.1513458217,-86.7808355753,"Dog Walkers, Pet Boarding, Pet Sitting, Pets, Pet Services, Pet Groomers, Pet Training",1
f9BC61P9Ps5pVD-AeDvsAw,Nashville,TN,36.080112564,-86.9528062727,"Mobile Phone Accessories, Mobile Phones, IT Services & Computer Repair, Mobile Phone Repair, Local Services, Shopping",0
_vZSIIqBsw_IUmxqNVOALA,Nashville,TN,36.1074485,-86.7550722,"Food, Restaurants, Cocktail Bars, Coffee Roasteries, Nightlife, Bars, Coffee & Tea, Cafes, Breakfast & Brunch",157
ei7oceWOL-u1hXsraus7ng,Nashville,TN,36.181959,-86.7355141399,"Food, Donuts, Cupcakes, Desserts, Bakeries",453
SNuTYRfrIRpBwswsXHj1lw,Nashville,TN,36.1498618992,-86.7974717103,"Salad, Pizza, Chicken Wings, Restaurants, Sandwiches",76
1mozd2AVfh6erj3av0-52Q,Nashville,TN,36.157509,-86.772627,"Bars, Whiskey Bars, Nightlife",4
JusM3uJlnImT0LbYutYxnw,Nashville,TN,36.1608593,-86.7806457,"Advertising, Professional Services, Marketing, Web Design, Video/Film Production",0
8eCcFUvQk6ojFccipx9ESA,Nashville,TN,36.063796,-86.915609,"Home Services, Apartments, Real Estate, Commercial Real Estate",17
boPXfBCG5P62kCnpyTARmw,Nashville,TN,36.1384966,-86.8835764,"Pets, Pet Services, Pet Stores, Pet Training, Pet Groomers",218
am3QhsWBeUfKwW4LgBIF6w,Nashville,TN,36.1026708,-86.8187098,"Delis, Restaurants, Diners",348
l3VSR7mOiHeVKst2L2-nWA,Nashville,TN,36.138177,-86.768049,"Electricians, Home Services",0
R9qdziBWlg89-wHm47SMWg,Nashville,TN,36.2047493867,-86.7785322735,"Restaurants, Cafes",2
P0Rg3sYWtPtheaiULYvxvw,Nashville,TN,36.129383,-86.83877,"Farmers Market, Food",55
sTF9IaVp9InG7mPUgu7Zfg,Nashville,TN,36.2130528,-86.7265483,"Junk Removal & Hauling, Local Services, Professional Services, Dumpster Rental",0
3oJFQGjjb5S1t024iK-JMA,Nashville,TN,36.136524,-86.8025399,"Sushi Bars, Restaurants",418
8eXfVJirzVsdtGqUH7t0rQ,Nashville,TN,36.150922,-86.779604,"Local Services, Fashion, Used, Vintage & Consignment, Musical Instrument Services, Guitar Stores, Shopping",76
Tnjw1ykBy1INMWRJcZWhJw,Nashville,TN,36.149149,-86.798326,"Bars, Wine Bars, Steakhouses, American (Traditional), Restaurants, Nightlife, American (New), Hotels & Travel, Tapas/Small Plates",279
rov8BWTpHoy5EQCvHMEuxw,Nashville,TN,36.18297,-86.748965,"Health & Medical, Acupuncture",173
m_kvoXITBvYDofmcKpWEmw,Nashville,TN,36.1305868213,-86.8022980158,"Jazz & Blues, American (Traditional), Dive Bars, Restaurants, Arts & Entertainment, Bars, Nightlife, Southern, Diners, Local Flavor",247
bH7UEhoG6Ga95uERCIDb3A,Nashville,TN,36.1643216,-86.780124,"Local Services, Shoe Repair",5
DOoJrrsqGzZN2FqzvllKnQ,Nashville,TN,36.1426916,-86.7916654,"Tacos, Mexican, Restaurants",1659
IsJrxG7Du7IKLlYsNl6Z9Q,Nashville,TN,36.0745455441,-86.922775358,"Fast Food, Restaurants, Burgers",66
qW58aRM5V7s-Y0VEW43cqw,Nashville,TN,36.2326095,-86.7576307,"Hotels & Travel, Hotels, Event Planning & Services",18
sbqw756QUPVKtqSXlvocRw,Nashville,TN,36.1551345585,-86.8095402635,"Fertility, Doctors, Health & Medical",9
PC1R_7bGEPvizRJMa0tzxA,Nashville,TN,36.1572803,-86.8037822,"Medical Spas, Beauty & Spas, Doctors, Skin Care, Hair Removal, Health & Medical, Laser Hair Removal, Plastic Surgeons, Cosmetic Surgeons",9
9QKCrKxjkHD5_ZlGNKPLtw,Nashville,TN,36.1819222816,-86.7356395339,"Cosmetics & Beauty Supply, Beauty & Spas, Shopping",16
2u5OFr5W2X09hibu1Orhgg,Nashville,TN,36.0158600618,-86.7047858209,"Restaurants, Pizza",1
oW8dGLAvYu7ZK4OC9qdQUg,Nashville,TN,36.143551,-86.873214,"Restaurants, Chicken Shop, Fast Food",0
CJd_pzf8QXiHuJq5i3RnCg,Nashville,TN,36.0193418,-86.7034832,"Beauty & Spas, Hair Extensions, Hair Salons, Blow Dry/Out Services",1
_aZAD5C0maYABO9KgddpPQ,Nashville,TN,36.1388605184,-86.8814560139,"Delis, Restaurants, Sandwiches, Fast Food",150
flXapkIt7SgwiWpCaLPfzg,Nashville,TN,36.1520020143,-86.8402328944,"Flowers & Gifts, Florists, Bridal, Shopping, Event Planning & Services, Floral Designers",0
tRVknko7n-J6meqL9PPiCQ,Nashville,TN,36.1582982349,-86.7766642329,"Tex-Mex, Restaurants, Mexican",353
HEieDamWKLO28dqNl2IPkA,Nashville,TN,36.1060361,-86.742328,"Oil Change Stations, Auto Parts & Supplies, Automotive, Auto Repair, Transmission Repair",0
oEb97wEwNikmzjoFiKkOtg,Nashville,TN,36.2227455,-86.7263518,"Supernatural Readings, Psychics, Arts & Entertainment",1
jUVk21Kkf7awzvnj8oci3Q,Nashville,TN,36.217725,-86.728987,"Restaurants, Latin American",357
XgmqH4xTI7MNyANg_AFjOw,Nashville,TN,36.1940873,-86.7597461,"Soul Food, Restaurants",14
4jISUD7S_gjIG0XWD4DO0Q,Nashville,TN,36.081019,-86.947374,"Arts & Entertainment, Cinema",90
F4HSQ5ZFHxSiEIJ86IAZ3A,Nashville,TN,36.1052855,-86.7553472,"Home Services, Interior Design, Contractors",0
XvFKxQj9lfLIUxRHrAodQA,Nashville,TN,36.148368,-86.806242,"Home Services, Social Clubs, Desserts, Restaurants, Coffee & Tea, Gluten-Free, Venues & Event Spaces, Vegan, Real Estate, Food, Arts & Entertainment, Shared Office Spaces, Event Planning & Services",424
m3f3ypSf8mJY1Or4vbvm9g,Nashville,TN,36.163095,-86.7818211,"Hotels & Travel, Restaurants, Flowers & Gifts, Shopping, Wedding Planning, Event Planning & Services, Florists",41
q39S4YaJo-OLEOX9-BJ9Lw,Nashville,TN,36.105239,-86.817369,"Restaurants, Delis, Sandwiches, Fast Food",90
XCvCuETNq4xKF5i-K24oSQ,Nashville,TN,36.1807191,-86.638672,"Shopping, Fashion, Department Stores",17
6P2bnqMco_nQ2Drp9utWjQ,Nashville,TN,36.1427355,-86.791595,"Shopping, Fashion, Accessories, Women's Clothing",11
Dxr9Fk3estkdC4heA8ZbEw,Nashville,TN,36.1017882,-86.8171597,"Formal Wear, Fashion, Accessories, Shopping, Bridal",1
4rZwsOtEdynIiyx40IQGAw,Nashville,TN,36.1626638,-86.7816016,"Hotels & Travel, Tours, Food Tours, Event Planning & Services, Historical Tours, Team Building Activities, Walking Tours",5
R2q1nVe4MVPckdlUTKIfDQ,Nashville,TN,36.1537447,-86.7651852,"Event Planning & Services, Venues & Event Spaces",29
QNn8ITVxSoI85r5lFZoPxg,Nashville,TN,36.1394226,-86.7236013,"Shopping, Astrologers, Supernatural Readings, Reiki, Hypnosis/Hypnotherapy, Local Flavor, Arts & Entertainment, Bookstores, Psychics, Books, Mags, Music & Video, Health & Medical",10
5dYfXNP5bB45B350bC4b3g,Nashville,TN,36.1969299011,-86.7416872875,"Automotive, Food, Gas Stations, Convenience Stores, Coffee & Tea",26
DjjOog1VQnI4F5Vwalf2tg,Nashville,TN,36.03581,-86.9721579,"Arts & Entertainment, Event Planning & Services, Venues & Event Spaces, Caterers, Music Venues, Nightlife, Wedding Planning, Personal Chefs",85
5GMz9S0NuQq_vVcRNgi1aw,Nashville,TN,36.1631451,-86.7715563,"Hotels & Travel, Rafting/Kayaking, Active Life, Boat Tours, Boating, Scavenger Hunts, Tours",8
8V-qJE7dXoDTUllWxrJ7cA,Nashville,TN,36.0440483,-86.958172,"Day Spas, Beauty & Spas",1
zYOL9x-tPD41eDFlcrGmcg,Nashville,TN,36.1394278,-86.7880374,"Public Services & Government, Libraries",36
gb7OP4yndTI3zSAnlL2xtg,Nashville,TN,36.193356,-86.832593,"Nail Salons, Beauty & Spas",2
eFZZrkHMI_XeBl14toQvew,Nashville,TN,36.152865,-86.774962,"Active Life, Tours, Event Planning & Services, Party Bus Rentals, DJs, Nightlife, Party Bike Rentals, Hotels & Travel",44
B1bANK-AA7Wd3KPthamcnQ,Nashville,TN,36.1641107,-86.7790899,"Event Planning & Services, Hotels & Travel, Hotels",82
_CAwB5NnsduM5LqMizG0OA,Nashville,TN,36.1199444893,-86.7771795839,"Automotive, Grocery, Food, Gas Stations, Convenience Stores",686
cv-Fmj7s5kdJfnu_dJTyow,Nashville,TN,36.1457988,-86.7794576,"Chiropractors, Health & Medical",2
6-wN6uwvvLQl14z7hbnPTw,Nashville,TN,36.1582317081,-86.801270779,"Cosmetics & Beauty Supply, Drugstores, Beauty & Spas, Shopping, Food, Convenience Stores, Photography Stores & Services",83
8LaVvL_1loxooSNXm5vbAQ,Nashville,TN,36.1294801,-86.8564604,"Pet Stores, Pets, Food, Pet Services, Pet Groomers",30
1YOkFJYmZG0LoGz-ftUdlQ,Nashville,TN,36.076052,-86.759561,"Shopping, Flowers & Gifts, Home Decor, Home & Garden, Florists, Event Planning & Services, Wedding Planning, Nurseries & Gardening, Floral Designers",51
chOk3zUwT0JtuVY8CLBBMg,Nashville,TN,36.1020218,-86.8168218,"Barbers, Beauty & Spas, Hair Salons",1
4T6snSpDCi0dQal8W_39zQ,Nashville,TN,36.1485077338,-86.8086261317,"Acupuncture, Naturopathic/Holistic, Doctors, Health & Medical",3
ju2K5yYV_MG22kLaFBkjbA,Nashville,TN,36.1478551708,-86.8085256154,"Automotive, Oil Change Stations, Auto Repair",33
N5tS8v0Yz4mmbFHMsxpr3g,Nashville,TN,36.1195807,-86.7756887,"Sandwiches, Delis, Fast Food, Food, Food Delivery Services, Restaurants",15
EGg5RHLfGxlq47nwPje9Zg,Nashville,TN,36.087363,-86.731346,"Auto Repair, Oil Change Stations, Automotive",13
qO-r-NipYXcuVXjIbaglEQ,Nashville,TN,36.106929,-86.817174,"Hair Salons, Beauty & Spas",10
bZ8ozC9y2c9RygG23Pr1BA,Nashville,TN,36.0644337,-86.7160539,"Professional Services, Shopping, Musical Instruments & Teachers",20
JRc-vzi_vpg9LAg7zYMFHw,Nashville,TN,36.1912034607,-86.7723985915,"Hair Extensions, Beauty & Spas, Hair Stylists, Eyelash Service, Hair Salons",7
US-WsXiVVQEp2lpWGD-BeA,Nashville,TN,36.1728396,-86.7652508,"Home Cleaning, Home Services",1
gqKhZNdJ-4GiwnU6s30CcA,Nashville,TN,36.17395,-86.750659,"Bakeries, Food, Coffee & Tea",38
1aR_kqb9d8jmRWCwXqoJJQ,Nashville,TN,36.1353016,-86.7236006,"Chicken Shop, American (New), Chicken Wings, American (Traditional), Restaurants, Soul Food",74
LotO2non7PgkxtskeV0gug,Nashville,TN,36.0440664,-86.9558572,"Nail Salons, Beauty & Spas",12
6yqH46TMr4GfE9lHR_iDFw,Nashville,TN,36.163551,-86.797127,"Cajun/Creole, Restaurants",3
TJ8H9Msb4jVasArDvpRDNA,Nashville,TN,36.1036929,-86.8174031,"Cosmetics & Beauty Supply, Skin Care, Beauty & Spas, Shopping",45
_VHaprnuIU8Tp_JBf6d7MA,Nashville,TN,36.1543238,-86.7217373,"Self Storage, Shopping, Local Services, Home & Garden, Movers, Home Services",2
AzzLcmoArkS0s10I5SwUjg,Nashville,TN,36.1420901,-86.8200729022,"Home Services, Apartments, Real Estate",2
AiOtNDU37CAg4E1vw_JJwg,Nashville,TN,36.1459829,-86.6304483,"Damage Restoration, Environmental Abatement, Local Services, Home Services, Contractors",1
UV3QgpYgHO0GGTYPPr4v3g,Nashville,TN,36.1265807821,-86.7895035761,"Restaurants, Mexican, Tex-Mex",672
fpIB6tw4RD-Ck6ImHJ2lHA,Nashville,TN,36.1183019,-86.7604172,"Contractors, Home Services, Door Sales/Installation, Windows Installation",4
ykrD-GI7pQpU_rHlHnEeag,Nashville,TN,36.1549763,-86.7771099,"Tacos, Breweries, Restaurants, Mexican, Distilleries, Food",489
DjCCD8xRKAJmM_r-kB1jOA,Nashville,TN,36.1641059312,-86.7834031016,"Event Planning & Services, Nightlife, Performing Arts, Venues & Event Spaces, Music Venues, Arts & Entertainment",173
gnEoEPubqm9WpXoOrM9hdg,Nashville,TN,36.1138000488,-86.7677001953,"Trainers, Fitness & Instruction, Active Life, Yoga",30
XV-p_kED6h5ulSTO7f3dyA,Nashville,TN,36.18344,-86.636855,"Beer, Wine & Spirits, Food",27
9ndyNLuGerjc0PFM80xJkg,Nashville,TN,36.108777,-86.810685,"Chiropractors, Nutritionists, Health & Medical, Massage Therapy, Acupuncture, Naturopathic/Holistic, Doctors",13
kcfBl1u4Zf-qppprSoa1FQ,Nashville,TN,36.159872157,-86.771840268,"Arts & Entertainment, Music Venues, Nightlife",292
OqutmtWhyRttbOfOCryU6Q,Nashville,TN,36.1287964,-86.9065301,"Restaurants, Pizza",9
YyW6LXHkAwjj1JR-ZHeQ4Q,Nashville,TN,36.1514264,-86.8068717,"Doctors, Health & Medical, Cosmetic Surgeons",2
LU8H8Xs9JPyF7eel7r1qog,Nashville,TN,36.150066,-86.776147,"Tires, Oil Change Stations, Auto Repair, Automotive",9
YzWmPgMGs7jw3U2Ypbx4Xw,Nashville,TN,36.1528601,-86.8314077,"Home Services, Heating & Air Conditioning/HVAC, Electricians",0
SeSALQNK5hiI0CT2XTLbrw,Nashville,TN,36.1807525,-86.8028713606,"Restaurants, Nightlife, Lounges, Seafood, Bars, Breakfast & Brunch",62
BFDQyF0mVD9in6ZKMd7aMg,Nashville,TN,36.094507,-86.653813,"Gas Stations, Coffee & Tea, Convenience Stores, Food, Automotive",14
3VdScOpQ4N1N-EqjA9NwZg,Nashville,TN,36.1572316392,-86.7706163526,"Sandwiches, Restaurants, Fast Food",0
1RQwJwViav_pzhT-zaDp6Q,Nashville,TN,36.0759728,-86.9212864,"Restaurants, Sushi Bars, Thai",206
3XsBtnrxijQGLqhBeEoCkQ,Nashville,TN,36.1881576082,-86.7770602994,"Auto Glass Services, Windshield Installation & Repair, Body Shops, Automotive",7
i2OfZTHrQj4E4YvNXrO7eQ,Nashville,TN,36.1244752,-86.8475033,"Home & Garden, Florists, Nurseries & Gardening, Shopping, Flowers & Gifts, Home Services, Gardeners",13
Pz3LKEUBDN6fz0QA6ARhvA,Nashville,TN,36.2147323,-86.7306747,"Nightlife, Cocktail Bars, Wine Bars, Bars",8
d4ZPdoYxDnT6f70AZPGrcw,Nashville,TN,36.1714178,-86.758903,"American (Traditional), Restaurants, Coffee & Tea, Breakfast & Brunch, Food",1213
b-hnQjGxzLQ4JuGATgf8TA,Nashville,TN,36.109612,-86.733773,"Shopping, Arts & Entertainment, Nightlife, Tattoo, Beauty & Spas, Piercing",4
_6QJBXB4SWXtjLcsKGFMRw,Nashville,TN,36.153147,-86.7903368,"Shopping, Women's Clothing, Fashion, Accessories, Men's Clothing",3
1JoOjG8HeaU3ggtN4M2h-g,Nashville,TN,36.10712927,-86.81570737,"Men's Clothing, Shopping, Plus Size Fashion, Fashion, Formal Wear",11
dU0qqkUwlwS_So3_yhAARA,Nashville,TN,36.1507454,-86.8012196,"Convenience Stores, Coffee & Tea, Discount Store, Food, Grocery, Shopping",8
dCmR7G3teIJ-yhjdV6Hi6A,Nashville,TN,36.169191,-86.810307,"Southern, Restaurants",13
8B5Fefz0pKBd3p34s7cj4A,Nashville,TN,36.1594987,-86.7741284,"Apartments, Home Services, Real Estate",6
HxU-aiv_9aqwiqYdXeEj1g,Nashville,TN,36.1513719,-86.8040443,"Restaurants, Bistros, Italian",6
O_Kd2-4DwjgiMh_GJ0Sg9g,Nashville,TN,36.176385,-86.786046,"Specialty Food, Food, Desserts, Bakeries, Chocolatiers & Shops",77
_uN0OudeJ3Zl_tf6nxg5ww,Nashville,TN,36.1433076,-86.8583026,"Restaurants, Thai",237
UqFuKIYcXrXUoWenCughyQ,Nashville,TN,36.1471586,-86.798898,"American (Traditional), Burgers, Restaurants, Sandwiches",3
-ZmzAg4-jR9edfePRSZfbA,Nashville,TN,36.2573300499,-86.6560229659,"Chinese, Restaurants",22
06crGgjjLih4VJrJ7BXJ7w,Nashville,TN,36.169588,-86.6832067,"Health & Medical, Shopping, Laser Eye Surgery/Lasik, Optometrists, Eyewear & Opticians",7
IjjUbIP7plAbNVV8o337xQ,Nashville,TN,36.1329055,-86.7181372,"American (Traditional), Restaurants, Cafeteria",44
H3G4upTI99ZKxtjLkDXz7Q,Nashville,TN,36.1493556487,-86.8595372,"Sandwiches, Fast Food, Restaurants",9
fM4u9otkFCcM5mUaJx3ZkQ,Nashville,TN,36.107588,-86.816455,"Fashion, Women's Clothing, Men's Clothing, Accessories, Shopping",23
OOR3XrzKolhdr5KUKMRBrg,Nashville,TN,36.0782498,-86.7597521,"Home Services, Heating & Air Conditioning/HVAC, Plumbing",0
JVFHfavzvCSdh72qWi1eZQ,Nashville,TN,36.1493237,-86.7781228,"Shopping, Food, Beer, Wine & Spirits, Wholesale Stores",664
vRAlLBLDONlptvp5sHwAqw,Nashville,TN,36.076764,-86.948031,"Printing Services, Local Services, IT Services & Computer Repair, Mobile Phone Repair, Shipping Centers, Office Equipment, Shopping",30
BPa3CLyhOQUKJrNY98nghQ,Nashville,TN,36.1524767,-86.7418142,"Tree Services, Home Services",1
wN1vFpypHurQDQUewhoGsg,Nashville,TN,36.090327,-86.698517,"Local Services, Pest Control",0
hvOWbFacsVZwFIAAXtN3BA,Nashville,TN,36.0881153743,-86.8759382002,"Art Museums, Arts & Entertainment, Art Galleries, Shopping, Public Services & Government, Festivals, Landmarks & Historical Buildings, Museums, Cultural Center, Botanical Gardens, Venues & Event Spaces, Event Planning & Services",651
V4lH5LdK9O3QQFvN9-R16g,Nashville,TN,36.177624,-86.790702,"Nightlife, Bars, Beer Gardens",30
MYCKPV_DPbqXL9VSHM4siQ,Nashville,TN,36.1551649,-86.7825589,"Food, Food Delivery Services",0
RG7PcKJDqmqrVxYxG1brAA,Nashville,TN,36.254047416,-86.716704585,"Banks & Credit Unions, Financial Services",10
2swc_ysOKnOYFRitokqK0w,Nashville,TN,36.1542475,-86.8059573,"Pediatricians, Health & Medical, Doctors",24
xDmDU2Fp2Sad0Ff88yE0vg,Nashville,TN,36.1583136422,-86.7892943204,"Cardio Classes, Fitness & Instruction, Yoga, Boot Camps, Gyms, Active Life, Cycling Classes",10
Y8djj3w2NPUkR5PoXwM4cA,Nashville,TN,36.17697293,-86.7508104023,"Restaurants, Seafood, Sports Bars, Bars, Nightlife, Pubs, Fish & Chips, Food, American (New), Beer, Wine & Spirits",10
uUoIUH5PKo22qxRXxZ_Ttg,Nashville,TN,36.2789554,-86.8720578,"Mexican, Restaurants",17
